"CC du Pays Beaume-Drobie",NA,19340,6.2,NA,240700302,84,7,NA,"Christophe",NA,"Artisan",NA,54,NA,NA,30.1,114
"CC du Pays Bellegardien (CCPB)","240100750",23330,5.5,NA,240100891,84,1,NA,"Patrick",NA,"Profession libérale",NA,58,NA,NA,16.4,198
"CC du Pays Bigouden Sud","200068120",22120,6.3,NA,242900702,53,29,NA,"Stéphane",NA,"Chef d'entreprise de 10 salariés ou plus",NA,47,NA,NA,30.3,293
"CC du Pays Châtillonnais",NA,19980,3.7,NA,242101434,27,21,NA,"Jérémie",NA,"Technicien",NA,39,NA,NA,28,118
"CC du Pays d'Alésia et de la Seine",NA,20820,4.2,NA,242101459,27,21,NA,"Patrick",NA,"Cadre de la fonction publique",NA,51,NA,NA,24.6,50
"CC du Pays d'Ancenis","244400404",21510,5.3,NA,244400552,52,NA,NA,"Maurice",NA,"Ancien artisan, commerçant, chef d'entreprise",NA,65,NA,NA,17,468
"CC du Pays d'Étain",NA,20150,2.9,NA,245501242,44,55,NA,"Philippe",NA,"Agriculteur sur moyenne exploitation",NA,54,NA,NA,19.4,51
"CC du Pays d'Héricourt","200069052",21660,5.3,NA,247000722,27,NA,NA,"Fernand",NA,"Cadre administratif et commercial d'entreprise",NA,67,NA,NA,20.9,146
"CC du Pays d'Huriel",NA,20370,3.4,NA,240300657,84,3,NA,"Jean-Elie",NA,"Ancien cadre",NA,72,NA,NA,23.5,39
"CC du Pays d'Iroise","242900314",23440,9.1,NA,242900074,53,29,NA,"André",NA,"Ancien artisan, commerçant, chef d'entreprise",NA,70,NA,NA,20.9,309
"CC du Pays d'Issoudun",NA,20700,4.2,NA,243600236,24,NA,NA,"André",NA,"Ancien cadre",NA,78,NA,NA,26.5,92
"CC du Pays d'Olmes",NA,18460,3,NA,240900464,76,9,NA,"Marc",NA,"Cadre administratif et commercial d'entreprise",NA,65,NA,NA,31.3,159
"CC du Pays d'Othe",NA,20390,4.1,NA,241000447,44,10,NA,"Daniel",NA,"Agriculteur sur moyenne exploitation",NA,62,NA,NA,23.9,57
"CC du Pays d'Urfé",NA,19440,2.9,NA,244200820,84,42,NA,"Charles",NA,"Ouvrier qualifié de type artisanal",NA,46,NA,NA,27.2,34
"CC du Pays d'Uzerche",NA,20870,4.8,NA,241927243,75,19,NA,"Catherine",NA,"Cadre administratif et commercial d'entreprise",NA,61,NA,NA,28.5,80
"CC du Pays de Barr","246700488",23850,7.3,NA,200034270,44,67,NA,"Claude",NA,"Agriculteur sur moyenne exploitation",NA,53,NA,NA,18.7,191
"CC du Pays de Bitche","200070746",21870,3.4,NA,200069441,44,57,NA,"David",NA,"Agriculteur sur petite exploitation",NA,39,NA,NA,21.1,197
"CC du Pays de Bray","200067999",21840,4,NA,246000913,32,60,NA,"Jean-Michel",NA,"Ancien cadre",NA,67,NA,NA,15.8,114
"CC du Pays de Château-Gontier",NA,20920,4.6,NA,245300447,52,53,NA,"Philippe",NA,"Cadre administratif et commercial d'entreprise",NA,50,NA,NA,21.4,206
"CC du Pays de Colombey et du Sud Toulois",NA,21180,3.5,NA,245400510,44,NA,NA,"Philippe",NA,"Ancien cadre",NA,63,NA,NA,16.7,86
"CC du Pays de Conches","200071454",21650,4.3,NA,242700276,28,27,NA,"Jérôme",NA,"Cadre de la fonction publique",NA,44,NA,NA,17.7,132
"CC du Pays de Craon","200083392",20020,2.6,NA,200048551,52,53,NA,"Christophe",NA,"Cadre administratif et commercial d'entreprise",NA,55,NA,NA,21.7,150
"CC du Pays de Cruseilles","200066793",35010,14.5,NA,247400112,84,74,NA,"Xavier",NA,"Agriculteur sur moyenne exploitation",NA,57,NA,NA,11.8,184
"CC du Pays de Dol et de la Baie du Mont-Saint-Michel","243500782",20350,3.2,NA,200070670,53,35,NA,NA,NA,NA,NA,NA,NA,NA,23.8,145
"CC du Pays de Duras",NA,18680,5.1,NA,244700449,75,47,NA,"Bernadette",NA,"Ancien agriculteur exploitant",NA,73,NA,NA,30.1,74
"CC du Pays de Falaise","200065597",20630,4.4,NA,241400514,28,14,NA,"Jean-Philippe",NA,"Agriculteur sur moyenne exploitation",NA,60,NA,NA,19.4,175
"CC du Pays de Fayence",NA,22710,8.7,NA,200004802,93,83,NA,"René",NA,"Cadre de la fonction publique",NA,75,NA,NA,24.6,550
"CC du Pays de Fénelon",NA,20430,4.1,NA,200040830,75,24,NA,"Patrick",NA,"Ancien cadre",NA,67,NA,NA,28.2,110
"CC du Pays de Honfleur-Beuzeville",NA,21640,6.8,NA,200066827,28,NA,NA,"Michel",NA,"Ancien employé",NA,60,NA,NA,20.6,301
"CC du Pays de l'Arbresle (CCPA)","200046977",25570,11.9,NA,246900625,84,69,NA,"Pierre-Jean",NA,"Ancienne profession intermédiaire",NA,67,NA,NA,17.7,474
"CC du Pays de l'Huisne Sarthoise","200072684",21100,3.6,NA,247200686,52,72,NA,"Didier",NA,"Cadre administratif et commercial d'entreprise",NA,62,NA,NA,22.1,127
"CC du Pays de l'Ourcq",NA,22630,4.2,NA,247700065,11,77,NA,"Pierre",NA,"Agriculteur sur moyenne exploitation",NA,58,NA,NA,13.4,165
"CC du Pays de l'Ozon","200046977",26620,10.8,NA,246900765,84,69,NA,"Pierre",NA,"Ancien artisan, commerçant, chef d'entreprise",NA,76,NA,NA,18.3,354
"CC du Pays de la Châtaigneraie",NA,19660,2.2,NA,248500415,52,85,NA,"Valentin",NA,"Commerçant et assimilé",NA,42,NA,NA,24.8,101
"CC du Pays de la Serre",NA,19660,2.7,NA,240200469,32,2,NA,"Carole",NA,"Technicien",NA,53,NA,NA,19.3,56
"CC du Pays de la Zorn",NA,24760,6.1,NA,246700959,44,67,NA,"Bernard",NA,"Ancien cadre",NA,62,NA,NA,18.3,106
"CC du Pays de Lalbenque-Limogne",NA,20960,6.5,NA,244600532,76,46,NA,"Jean-Claude",NA,"Ancien employé",NA,66,NA,NA,27.9,106
"CC du Pays de Lamastre",NA,18830,4.6,NA,200016905,84,7,NA,"Jean-Paul",NA,"Personne diverse sans activité professionnelle de moins de 60 ans (sauf retraité)",NA,58,NA,NA,28,60
"CC du Pays de Landerneau-Daoulas","242900314",22910,8.3,NA,242900801,53,29,NA,"Patrick",NA,"Commerçant et assimilé",NA,52,NA,NA,17.8,326
"CC du Pays de Landivisiau","242900314",20710,4.3,NA,242900751,53,29,NA,"Henri",NA,"Ancien agriculteur exploitant",NA,64,NA,NA,17.7,198
"CC du Pays de Lapalisse",NA,19600,2.6,NA,240300491,84,3,NA,"Jacques",NA,"Profession intermédiaire administrative de la fonction publique",NA,60,NA,NA,26.6,51
"CC du Pays de Lauzun",NA,18690,3.5,NA,244700464,75,47,NA,"Emilien",NA,"Cadre administratif et commercial d'entreprise",NA,35,NA,NA,34.5,90
"CC du Pays de Limours (CCPL)","200054781",29700,17.5,NA,249100074,11,91,NA,"Dany",NA,"Profession de l'information, des arts et des spectacles",NA,55,NA,NA,16.6,302
"CC du Pays de Lubersac-Pompadour",NA,20330,4.6,NA,200066603,75,19,NA,"Francis",NA,"Professeur, profession scientifique",NA,59,NA,NA,31.3,65
"CC du Pays de Lumbres","200069037",20070,3.6,NA,246201016,32,62,NA,"Christian",NA,"Chef d'entreprise de 10 salariés ou plus",NA,55,NA,NA,15.6,127
"CC du Pays de Lunel","243400017",19760,7.2,NA,243400520,76,34,NA,"Pierre",NA,"Ancien cadre",NA,67,NA,NA,18.6,794
"CC du Pays de Lure",NA,20600,4.2,NA,247000664,27,70,NA,"Isabelle",NA,"Ancienne profession intermédiaire",NA,60,NA,NA,20.6,143
"CC du Pays de Luxeuil",NA,19270,4.3,NA,247000755,27,70,NA,"Jacques",NA,"Cadre de la fonction publique",NA,60,NA,NA,23.5,97
"CC du Pays de Maîche",NA,27070,3.3,NA,200023075,27,25,NA,NA,NA,NA,NA,NA,NA,NA,18.5,113
"CC du Pays de Mauriac",NA,20020,3.7,NA,241500271,84,15,NA,"Jean Pierre",NA,"Ancien cadre",NA,71,NA,NA,30.1,33
"CC du Pays de Meslay-Grez","200083392",20530,4.1,NA,245300223,52,53,NA,"Jacky",NA,"Ancien cadre",NA,63,NA,NA,18.7,79
"CC du Pays de Mirepoix",NA,19340,6,NA,200044469,76,9,NA,"Alain",NA,"Profession libérale",NA,55,NA,NA,25.7,120
"CC du Pays de Montbozon et du Chanois",NA,21690,4.5,NA,200041853,27,70,NA,"Sabrina",NA,"Commerçant et assimilé",NA,52,NA,NA,20.4,37
"CC du Pays de Montfaucon",NA,20660,3.4,NA,244300307,84,43,NA,"Bernard",NA,"Ancien agriculteur exploitant",NA,63,NA,NA,24.2,60
"CC du Pays de Montmédy",NA,21250,2.8,NA,245501259,44,55,NA,"Eric",NA,"Ancien cadre",NA,65,NA,NA,17.2,35
"CC du Pays de Mormal","200043396",21440,6.5,NA,200043321,32,59,NA,"Guislain",NA,"Cadre de la fonction publique",NA,49,NA,NA,18.9,329
"CC du Pays de Mortagne",NA,21640,3.6,NA,248500662,52,85,NA,"Guillaume",NA,"Cadre de la fonction publique",NA,45,NA,NA,19,178
"CC du Pays de Mortagne-au-Perche",NA,20290,4.9,NA,200036069,28,61,NA,"Jean-Claude",NA,"Ancien cadre",NA,76,NA,NA,26.8,106
"CC du Pays de Mortagne-au-Perche",NA,20290,4.9,NA,200036069,28,61,NA,"Jean-Claude",NA,"Ancien cadre",NA,76,NA,NA,26.8,106
"CC du Pays de Niederbronn-les-Bains","200067874",22430,3.6,NA,246701098,44,67,NA,"Patrice",NA,"Professeur, profession scientifique",NA,47,NA,NA,21.1,144
"CC du Pays de Phalsbourg","200068146",22110,4.1,NA,245700950,44,57,NA,"Christian",NA,"Ancien cadre",NA,61,NA,NA,18.7,108
"CC du Pays de Pontchâteau Saint-Gildas-des-Bois","244400644",21500,3.1,NA,200000438,52,44,NA,"Jean-Louis",NA,"Profession libérale",NA,63,NA,NA,17.9,217
"CC du Pays de Pouzauges",NA,20590,2.6,NA,248500464,52,85,NA,"Bérangère",NA,"Cadre administratif et commercial d'entreprise",NA,47,NA,NA,19.9,131
"CC du Pays de Revigny-sur-Ornain",NA,20800,2.8,NA,245501184,44,55,NA,"Anne",NA,"Agriculteur sur moyenne exploitation",NA,60,NA,NA,21.2,27
"CC du Pays de Ribeauvillé","246800726",24150,6.8,NA,246800577,44,68,NA,NA,NA,NA,NA,NA,NA,NA,22.1,155
"CC du Pays de Rouffach,Vignobles et Châteaux",NA,25430,8.6,NA,246800494,44,68,NA,NA,NA,NA,NA,NA,NA,NA,20.2,110
"CC du Pays de Saint-Aulaye",NA,18830,3.4,NA,242400935,75,24,NA,"Yannick",NA,"Ancien cadre",NA,67,NA,NA,32.3,63
"CC du Pays de Saint-Éloy",NA,19140,3.3,NA,200072080,84,63,NA,"Laurent",NA,"Technicien",NA,50,NA,NA,29.3,116
"CC du Pays de Saint-Fulgent - Les Essarts","200070233",21360,3.3,NA,200071918,52,85,NA,"Jacky",NA,"Technicien",NA,56,NA,NA,15.9,169
"CC du Pays de Saint-Gilles-Croix-de-Vie","200071629",22000,3.6,NA,200023778,52,85,NA,"François",NA,"Profession de l'information, des arts et des spectacles",NA,45,NA,NA,33.6,462
"CC du Pays de Saint-Yrieix","248719312",20030,4.3,NA,248700189,75,NA,NA,"Daniel",NA,"Ancienne profession intermédiaire",NA,75,NA,NA,31.6,96
"CC du Pays de Sainte-Odile",NA,23850,8.9,NA,246701080,44,67,NA,"Bernard",NA,"Ancien artisan, commerçant, chef d'entreprise",NA,65,NA,NA,20.2,182
"CC du Pays de Salars",NA,21810,4.5,NA,241200658,76,12,NA,"Yves",NA,"Agriculteur sur moyenne exploitation",NA,57,NA,NA,21.8,61
"CC du Pays de Salers",NA,19240,2.8,NA,241501139,84,15,NA,"Bruno",NA,"Ingénieur et cadre technique d'entreprise",NA,54,NA,NA,33.1,33
"CC du Pays de Sancey-Belleherbe",NA,21530,3.5,NA,242504371,27,25,NA,NA,NA,NA,NA,NA,NA,NA,22.6,39
"CC du Pays de Saverne","246700488",22780,7.1,NA,200068112,44,67,NA,"Dominique",NA,"Professeur des écoles, instituteur et assimilé",NA,57,NA,NA,20.4,250
"CC du Pays de Serres en Quercy",NA,18290,5,NA,200040418,76,82,NA,NA,NA,NA,NA,NA,NA,NA,31.6,78
"CC du Pays de Sommières","243000643",21730,9.1,NA,243000296,76,30,NA,"Pierre",NA,"Professeur, profession scientifique",NA,52,NA,NA,18.9,346
"CC du Pays de Stenay et du Val Dunois",NA,19630,2.5,NA,200066132,44,55,NA,"Daniel",NA,"Ancien cadre",NA,72,NA,NA,26.2,33
"CC du Pays de Tarascon",NA,19650,4.7,NA,240900431,76,9,NA,"Philippe",NA,"Ancien employé",NA,59,NA,NA,29.1,79
"CC du Pays de Trie et du Magnoac",NA,19500,4.2,NA,200070795,76,65,NA,"Gérard",NA,"Employé de commerce",NA,49,NA,NA,32.7,67
"CC du Pays de Tronçais",NA,19290,4.2,NA,240300558,84,3,NA,"Daniel",NA,"Ancien artisan, commerçant, chef d'entreprise",NA,72,NA,NA,33,57
"CC du Pays de Valois",NA,24160,5.7,NA,246000871,32,60,NA,"Didier",NA,"Cadre administratif et commercial d'entreprise",NA,55,NA,NA,14.5,419
"CC du Pays de Villeneuve en Armagnac Landais",NA,20670,3.9,NA,244000774,75,40,NA,"Jean-Yves",NA,"Ancien employé",NA,64,NA,NA,24.5,39
"CC du Pays de Villersexel",NA,20430,2.8,NA,247000714,27,NA,NA,"Daniel",NA,"Ancien cadre",NA,67,NA,NA,23.5,36
"CC du Pays de Wissembourg",NA,23370,6.5,NA,246700926,44,67,NA,"Serge",NA,"Ancien cadre",NA,72,NA,NA,20.6,102
"CC du Pays des Abers","242900314",22440,5.9,NA,242900553,53,29,NA,"Jean-François",NA,"Agriculteur sur moyenne exploitation",NA,64,NA,NA,18.8,298
"CC du Pays des Achards",NA,21030,3.5,NA,248500530,52,85,NA,"Patrice",NA,"Ancien cadre",NA,66,NA,NA,17.6,164
"CC du Pays des Ecrins",NA,20470,7.3,NA,240500462,93,5,NA,"Cyrille",NA,"Profession libérale",NA,49,NA,NA,21,93
"CC du Pays des Herbiers",NA,21360,4.6,NA,248500621,52,85,NA,"Véronique",NA,"Personne diverse sans activité professionnelle de moins de 60 ans (sauf retraité)",NA,57,NA,NA,17,240
"CC du Pays des Herbiers",NA,21360,4.6,NA,248500621,52,85,NA,"Véronique",NA,"Personne diverse sans activité professionnelle de moins de 60 ans (sauf retraité)",NA,57,NA,NA,17,240
"CC du Pays des Paillons","200030195",22740,5.6,NA,240600593,93,6,NA,"Maurice",NA,"Ancien artisan, commerçant, chef d'entreprise",NA,78,NA,NA,22,308
"CC du Pays des Sorgues et des Monts de Vaucluse","248400251",21710,8.6,NA,248400319,93,84,NA,"Pierre",NA,"Ancien artisan, commerçant, chef d'entreprise",NA,52,NA,NA,22.3,480
"CC du Pays des Sources","200067965",22850,5,NA,246000855,32,60,NA,"René",NA,"Ancien agriculteur exploitant",NA,68,NA,NA,15.8,160
"CC du Pays du Coquelicot",NA,20640,3.3,NA,248000747,32,80,NA,"Michel",NA,"Agriculteur sur moyenne exploitation",NA,60,NA,NA,20.6,166
"CC du Pays du Neubourg","200066413",22960,4.3,NA,242700607,28,27,NA,"Jean-Paul",NA,"Profession libérale",NA,72,NA,NA,17.2,151
"CC du Pays du Saintois",NA,22810,5.8,NA,200035772,44,54,NA,"Jérôme",NA,"Cadre de la fonction publique",NA,41,NA,NA,18.3,100
"CC du Pays du Sanon",NA,21850,3,NA,245400759,44,54,NA,"Jacques",NA,"Cadre de la fonction publique",NA,69,NA,NA,19.6,37
"CC du Pays du Vermandois","200071892",19430,3.1,NA,240200493,32,2,NA,"Marcel",NA,"Ancien cadre",NA,75,NA,NA,19.3,153
"CC du Pays entre Loire et Rhône","200035731",20870,3.5,NA,244200630,84,42,NA,"Jean Paul",NA,"Cadre de la fonction publique",NA,65,NA,NA,21.4,103
"CC du Pays Fertois et du Bocage Carrougien",NA,20100,3.6,NA,200071652,28,61,NA,"Claudine",NA,"Ancien cadre",NA,58,NA,NA,24.2,25
"CC du Pays Fléchois",NA,20700,4,NA,247200348,52,72,NA,"Nadine",NA,"Profession intermédiaire de la santé et du travail social",NA,62,NA,NA,20.3,136
"CC du Pays Fouesnantais","200068120",24270,9.3,NA,242900660,53,29,NA,"Roger",NA,"Ancien cadre",NA,73,NA,NA,28.1,236
"CC du Pays Foyen",NA,18500,4.1,NA,243301371,75,NA,NA,"Pierre",NA,"Ancien cadre",NA,69,NA,NA,28.5,119
"CC du Pays Gentiane",NA,19240,3.3,NA,241500255,84,15,NA,"Valérie",NA,"Employé civil et agent de service de la fonction publique",NA,41,NA,NA,32.7,44
"CC du Pays Grenadois",NA,21050,3.8,NA,244000824,75,40,NA,"Jean-Luc",NA,"Ancien agriculteur exploitant",NA,64,NA,NA,22.4,44
"CC du Pays Haut Val d'Alzette","245701362",23220,4.2,NA,245701404,44,NA,NA,"Patrick",NA,"Ancien cadre",NA,66,NA,NA,18.8,127
"CC du Pays Houdanais (C.C.P.H.)","200040277",27360,10.8,NA,247800550,NA,NA,NA,"Jean-Marie",NA,"Ancien cadre",NA,71,NA,NA,17,344
"CC du Pays Loudunais",NA,19160,2.8,NA,248600447,75,86,NA,"Joël",NA,"Ancien cadre",NA,64,NA,NA,25.6,135
"CC du Pays Morcenais",NA,20380,3.6,NA,244000691,75,40,NA,"Jérôme",NA,"Cadre de la fonction publique",NA,48,NA,NA,29.4,57
"CC du Pays Mornantais (COPAMO)","200046977",25910,10.2,NA,246900740,84,69,NA,"Renaud",NA,"Personne diverse sans activité professionnelle de moins de 60 ans (sauf retraité)",NA,41,NA,NA,15.9,340
"CC du Pays Noyonnais","200067965",19640,3.4,NA,246000756,32,60,NA,"Sandrine",NA,"Cadre administratif et commercial d'entreprise",NA,45,NA,NA,17.9,173
"CC du Pays Orne Moselle","200039949",20870,4,NA,245701271,44,57,NA,"Lionel",NA,"Ancien cadre",NA,66,NA,NA,19.3,366
"CC du Pays Rethélois","200067213",21000,4,NA,200043156,44,8,NA,"Renaud",NA,"Cadre de la fonction publique",NA,46,NA,NA,19,192
"CC du Pays Réuni d'Orange","248400160",19570,5.8,NA,248400236,93,84,NA,"Jacques",NA,"Profession libérale",NA,78,NA,NA,21,519
"CC du Pays Réuni d'Orange","248400160",19570,5.8,NA,248400236,93,84,NA,"Jacques",NA,"Profession libérale",NA,78,NA,NA,21,519
"CC du Pays Réuni d'Orange","248400160",19570,5.8,NA,248400236,93,84,NA,"Jacques",NA,"Profession libérale",NA,78,NA,NA,21,519
"CC du Pays Rhénan","200067874",25000,5.8,NA,200041325,44,67,NA,"Denis",NA,"Ancien cadre",NA,72,NA,NA,18.3,227
"CC du Pays Rignacois",NA,21060,5.8,NA,241200625,76,12,NA,"Jean-Marc",NA,"Chef d'entreprise de 10 salariés ou plus",NA,69,NA,NA,23.3,50
"CC du Pays Riolais","242500361",22580,6.9,NA,247000706,27,70,NA,"Nadine",NA,"Cadre de la fonction publique",NA,50,NA,NA,15.8,84
"CC du Pays Rochois","200000172",29310,9.7,NA,247400724,84,74,NA,"Jean-Claude",NA,"Ancien cadre",NA,64,NA,NA,12.8,296
"CC du Pays Solesmois","200030633",20350,4.8,NA,245901038,32,59,NA,"Paul",NA,"Profession intermédiaire de la santé et du travail social",NA,60,NA,NA,19.5,80
"CC du Pays Tarusate",NA,20990,3.2,NA,244000766,75,40,NA,"Laurent",NA,"Cadre de la fonction publique",NA,45,NA,NA,23.8,140
"CC du Pays Viganais",NA,17720,6.6,NA,243000270,76,30,NA,"Régis",NA,"Professeur, profession scientifique",NA,45,NA,NA,28.1,108
"CC du Perche",NA,20700,4.1,NA,200006971,24,28,NA,"Harold",NA,"Cadre de la fonction publique",NA,39,NA,NA,28,120
"CC du Perche et Haut Vendômois",NA,20800,2.9,NA,200040772,24,41,NA,"Alain",NA,"Personne diverse sans activité professionnelle de 60 ans et plus (sauf retraité)",NA,62,NA,NA,25.4,81
"CC du Périgord Nontronnais",NA,19180,4,NA,200071819,75,24,NA,"Gérard",NA,"Ancien cadre",NA,73,NA,NA,34.2,163
"CC du Périgord Ribéracois",NA,19410,4.3,NA,200040400,75,24,NA,"Didier",NA,"Agriculteur sur moyenne exploitation",NA,59,NA,NA,31,224
"CC du Piémont Cévenol","200066918",19730,7.1,NA,200034411,76,30,NA,"Fabien",NA,"Professeur des écoles, instituteur et assimilé",NA,41,NA,NA,23.3,249
"CC du Pilat Rhodanien",NA,23120,6.6,NA,244200895,84,42,NA,"Serge",NA,"Cadre de la fonction publique",NA,64,NA,NA,19.4,201
"CC du Pithiverais","200071850",21050,3.6,NA,200066280,24,45,NA,"James",NA,"Cadre de la fonction publique",NA,63,NA,NA,19,188
"CC du Pithiverais-Gâtinais","200066280",21510,3.3,NA,200071850,24,45,NA,"Delmira",NA,"Personne diverse sans activité professionnelle de moins de 60 ans (sauf retraité)",NA,55,NA,NA,20.4,194
"CC du Plateau de Frasne et du Val de Drugeon (CFD)",NA,26030,3.5,NA,242504496,27,25,NA,"Christian",NA,"Ancien employé",NA,63,NA,NA,14.8,53
"CC du Plateau de Lannemezan",NA,20560,4.7,NA,200070787,76,65,NA,"Bernard",NA,"Ancien cadre",NA,76,NA,NA,28.7,157
"CC du Plateau de Montbazens",NA,20500,4.1,NA,241200674,76,12,NA,"Jacques",NA,"Agriculteur sur moyenne exploitation",NA,61,NA,NA,27.9,48
"CC du Plateau de Russey",NA,29930,3.2,NA,242504355,27,25,NA,"Gilles",NA,"Professeur, profession scientifique",NA,63,NA,NA,13.8,38
"CC du Plateau Picard","246000376",21400,3.5,NA,246000566,32,60,NA,"Frans",NA,"Agriculteur sur grande exploitation",NA,67,NA,NA,15.7,173
"CC du Pont du Gard","243000643",21180,6.9,NA,243000684,76,30,NA,"Pierre",NA,"Profession intermédiaire administrative de la fonction publique",NA,62,NA,NA,18.9,276
"CC du Provinois",NA,20960,5.2,NA,200037133,11,77,NA,"Olivier",NA,"Cadre de la fonction publique",NA,50,NA,NA,17.8,299
"CC du Quercy Blanc","200023737",19660,5.4,NA,200039519,76,46,NA,"Bernard",NA,"Ancien cadre",NA,67,NA,NA,30.5,79
"CC du Quercy Caussadais",NA,19610,3.9,NA,248200057,76,82,NA,"Guy",NA,"Chef d'entreprise de 10 salariés ou plus",NA,59,NA,NA,25.8,168
"CC du Quercy Rouergue et des Gorges de l'Aveyron",NA,18470,6.8,NA,248200107,76,NA,NA,"Gilles",NA,"Ancien cadre",NA,70,NA,NA,31.5,111
"CC du Réolais en Sud Gironde","243300316",19110,3.9,NA,200044394,75,33,NA,"Francis",NA,"Cadre de la fonction publique",NA,63,NA,NA,23.3,224
"CC du Réquistanais",NA,19260,3.1,NA,241200542,76,12,NA,"Michel",NA,"Ancienne profession intermédiaire",NA,74,NA,NA,33.5,38
"CC du Rhône aux Gorges de l'Ardèche",NA,20610,5.4,NA,240700864,84,7,NA,"Françoise",NA,"Cadre de la fonction publique",NA,49,NA,NA,22.2,170
"CC du Ried de Marckolsheim","246700967",23250,3.5,NA,200030526,44,NA,NA,"Frédéric",NA,"Professeur, profession scientifique",NA,56,NA,NA,16.1,138
"CC du Romorantinais et du Monestois",NA,20540,3.6,NA,200018406,24,41,NA,"Jeanny",NA,"Ancien cadre",NA,71,NA,NA,25.4,232
"CC du Rouillacais",NA,20610,3.8,NA,241600303,75,16,NA,"Christian",NA,"Agriculteur sur moyenne exploitation",NA,59,NA,NA,23.6,77
"CC du Royans-Vercors",NA,20560,5.2,NA,200067767,84,26,NA,"Pierre-Louis",NA,"Cadre de la fonction publique",NA,39,NA,NA,23.5,124
"CC du Sammiellois",NA,20240,2.8,NA,245500327,44,55,NA,"Régis",NA,"Ancien cadre",NA,65,NA,NA,22.7,56
"CC du Sartenais Valinco Taravo",NA,20310,6.8,NA,242010130,94,NA,NA,"José Pierre",NA,"Profession libérale",NA,43,NA,NA,26.3,182
"CC du Saulnois",NA,20810,3.6,NA,245701206,44,57,NA,"Jérôme",NA,"Cadre de la fonction publique",NA,42,NA,NA,20.5,167
"CC du Saves",NA,21850,7,NA,243200599,76,32,NA,"Hervé",NA,"Professeur, profession scientifique",NA,55,NA,NA,25.4,106
"CC du Secteur de Saint-Loubès","243300316",23470,7.4,NA,243301249,75,33,NA,"Frédéric",NA,"Profession intermédiaire administrative de la fonction publique",NA,52,NA,NA,18.3,370
"CC du Seignanx","200067106",22480,6.5,NA,244000659,75,40,NA,"Isabelle",NA,"Cadre de la fonction publique",NA,60,NA,NA,21.2,322
"CC du Serein",NA,21130,4,NA,200039709,27,89,NA,"Xavier",NA,"Agriculteur sur grande exploitation",NA,46,NA,NA,27.1,41
"CC du Sisteronais-Buëch",NA,19700,5.7,NA,200068765,NA,NA,NA,"Daniel",NA,"Ancien cadre",NA,80,NA,NA,27.6,257
"CC du Sisteronais-Buëch",NA,19700,5.7,NA,200068765,NA,NA,NA,"Daniel",NA,"Ancien cadre",NA,80,NA,NA,27.6,257
"CC du Sor et de l'Agout","248100430",21020,5.4,NA,248100158,76,81,NA,"Sylvain",NA,"Ancien cadre",NA,81,NA,NA,21.9,246
"CC du Sud",NA,NA,NA,NA,200060473,6,976,NA,"Ali Moussa",NA,"Technicien",NA,55,NA,NA,NA,171
"CC du Sud-Artois","200033579",20120,3.4,NA,200035442,32,62,NA,"Jean-Jacques",NA,"Ancienne profession intermédiaire",NA,67,NA,NA,18.5,150
"CC du Sud-Estuaire","200067346",22240,4.8,NA,244400586,52,44,NA,"Yannick",NA,"Profession libérale",NA,60,NA,NA,22.1,270
"CC du Sud Avesnois",NA,16980,2.6,NA,200043404,32,59,NA,"Mickaël",NA,"Personne diverse sans activité professionnelle de moins de 60 ans (sauf retraité)",NA,49,NA,NA,20.5,129
"CC du Sud Corse",NA,20010,6.1,NA,200040764,94,NA,NA,"Jean-Christophe",NA,"Commerçant et assimilé",NA,45,NA,NA,19.6,531
"CC du Sud Est du Pays Manceau","247200132",22890,5.6,NA,247200421,52,72,NA,"Nicolas",NA,"Profession libérale",NA,45,NA,NA,19.2,121
"CC du Sud Gironde","243300316",20640,5.4,NA,200043974,75,33,NA,"Jérôme",NA,"Professeur, profession scientifique",NA,54,NA,NA,20.7,432
"CC du Sud Marnais",NA,21040,2.6,NA,245100979,44,51,NA,"Bernard",NA,"Ancien ouvrier",NA,65,NA,NA,21.3,40
"CC du Sud Messin","200039865",24340,6.9,NA,200039907,44,57,NA,"Brigitte",NA,"Ancien cadre",NA,64,NA,NA,15.1,127
"CC du Sud Territoire","200065647",22870,4.1,NA,249000241,27,90,NA,"Christian",NA,"Ancien artisan, commerçant, chef d'entreprise",NA,68,NA,NA,19.8,176
"CC du Ternois","200072460",18980,3.2,NA,200069672,32,NA,NA,"Marc",NA,"Profession libérale",NA,73,NA,NA,21.2,175
"CC du Terrassonnais en Périgord Noir Thenon Hautefort",NA,19620,4,NA,200041150,75,24,NA,"Dominique",NA,"Profession libérale",NA,67,NA,NA,27,178
"CC du Terrassonnais en Périgord Noir Thenon Hautefort",NA,19620,4,NA,200041150,75,24,NA,"Dominique",NA,"Profession libérale",NA,67,NA,NA,27,178
"CC du Territoire de Fresnes-en-Woëvre",NA,21050,3.9,NA,245501176,44,55,NA,"Laurent",NA,"Artisan",NA,52,NA,NA,21,29
"CC du Territoire de Lunéville à Baccarat","245400676",20070,3.8,NA,200070324,44,54,NA,"Bruno",NA,"Cadre administratif et commercial d'entreprise",NA,45,NA,NA,21.1,302
"CC du Territoire Nord Picardie","248000531",20910,4.5,NA,200070951,32,80,NA,"Christelle",NA,"Cadre de la fonction publique",NA,48,NA,NA,19.3,176
"CC du Thouarsais","200040244",19810,3.1,NA,247900798,75,79,NA,"Bernard",NA,"Chef d'entreprise de 10 salariés ou plus",NA,65,NA,NA,24.3,209
"CC du Triangle Vert",NA,21210,3.3,NA,200041861,27,70,NA,"Benjamin",NA,"Profession libérale",NA,35,NA,NA,18.6,92
"CC du Trièves","200040715",22050,9.1,NA,200030658,84,38,NA,"Jérôme",NA,"Professeur, profession scientifique",NA,60,NA,NA,22.7,125
"CC du Val d'Amboise","243700754",21880,6.4,NA,200043065,24,37,NA,"Thierry",NA,"Employé civil et agent de service de la fonction publique",NA,49,NA,NA,22.5,236
"CC du Val d'Amour",NA,21050,4.4,NA,243900420,27,39,NA,"Etienne",NA,"Cadre administratif et commercial d'entreprise",NA,49,NA,NA,23,71
"CC du Val d'Argent",NA,20380,3.7,NA,246800395,44,68,NA,NA,NA,NA,NA,NA,NA,NA,20.6,51
"CC du Val d'Ay",NA,20910,4.1,NA,240700716,84,7,NA,"Marie",NA,"Employé civil et agent de service de la fonction publique",NA,52,NA,NA,23.1,30
"CC du Val d'Essonne (CCVE)","200059228",26270,9.7,NA,249100546,11,91,NA,"Patrick",NA,"Cadre administratif et commercial d'entreprise",NA,47,NA,NA,16.1,688
"CC du Val d'Ille-Aubigné","243500139",23380,10.5,NA,243500667,53,35,NA,"Claude",NA,"Ancien cadre",NA,71,NA,NA,13.7,299
"CC du Val d'Orne",NA,19930,4.7,NA,246100390,28,61,NA,"Sébastien",NA,"Cadre de la fonction publique",NA,47,NA,NA,22.7,33
"CC du Val de Bouzanne",NA,20060,2.7,NA,200018521,24,36,NA,"Christian",NA,"Ancien cadre",NA,68,NA,NA,25.7,31
"CC du Val de Cher",NA,20530,3,NA,240300566,84,3,NA,"Mohammed",NA,"Ancienne profession intermédiaire",NA,63,NA,NA,24.8,36
"CC du Val de Drôme en Biovallée","200068781",21500,7.1,NA,242600252,84,26,NA,"Jean",NA,"Professeur, profession scientifique",NA,70,NA,NA,19.6,357
"CC du Val de l'Aisne","240200477",21040,3.7,NA,240200501,32,2,NA,"Thierry",NA,"Cadre administratif et commercial d'entreprise",NA,56,NA,NA,18,107
"CC du Val de l'Eyre","243300316",23100,6.5,NA,243301405,75,33,NA,"Bruno",NA,"Cadre de la fonction publique",NA,59,NA,NA,15.3,280
"CC du Val de l'Oise","200071892",20800,3.3,NA,200040426,32,2,NA,"Didier",NA,"Agriculteur sur moyenne exploitation",NA,61,NA,NA,20.2,84
"CC du Val de Morteau",NA,31410,6.4,NA,242504116,27,25,NA,"Cédric",NA,"Ingénieur et cadre technique d'entreprise",NA,42,NA,NA,16.6,173
"CC du Val de Sarthe","247200132",22300,4.3,NA,247200629,52,72,NA,"Emmanuel",NA,"Cadre administratif et commercial d'entreprise",NA,50,NA,NA,18.3,155
"CC du Val de Somme","248000531",22200,5.3,NA,248000499,32,80,NA,"Alain",NA,"Ancienne profession intermédiaire",NA,72,NA,NA,18.2,151
"CC du Val de Sully","244500468",22010,4.4,NA,200070100,24,45,NA,"Gérard",NA,"Ancien cadre",NA,68,NA,NA,20.6,149
"CC du Val de Vienne","248719312",22540,6.5,NA,248719288,75,87,NA,"Philippe",NA,"Cadre de la fonction publique",NA,55,NA,NA,21.2,100
