nom,nom_minimise,SIREN,code_region,code_departement
CC du Pays de Niederbronn-les-Bains,CC PAYS NIEDERBRONN LES BAINS,246701098,44,67
CC du Pays de Phalsbourg,CC PAYS DE PHALSBOURG,245700950,44,57
CC du Pays de Pontchâteau Saint-Gildas-des-Bois,CC PAYS PONTCHATEAU SAINT-GILDAS,200000438,52,44
CC du Pays de Pouzauges,CC DU PAYS DE POUZAUGES,248500464,52,85
CC du Pays de Revigny-sur-Ornain,CC REVIGNY-SUR-ORNAIN,245501184,44,55
CC du Pays de Ribeauvillé,CC PAYS RIBEAUVILLE,246800577,44,68
"CC du Pays de Rouffach,Vignobles et Châteaux",CC PAYS ROUFFACH VIGNOBLES CHT,246800494,44,68
CC du Pays de Saint-Aulaye,CC PAYS DE SAINT-AULAYE,242400935,75,24
CC du Pays de Saint-Éloy,CC DU PAYS DE SAINT ELOY,200072080,84,63
CC du Pays de Saint-Fulgent - Les Essarts,CC PAYS ST-FULGENT-LES ESSARTS,200071918,52,85
CC du Pays de Saint-Gilles-Croix-de-Vie,CC PAYS ST-GILLES-CROIX-DE-VIE,200023778,52,85
CC du Pays de Saint-Yrieix,CC PAYS DE SAINT-YRIEIX,248700189,75,"19,87"
CC du Pays de Sainte-Odile,CC PAYS DE SAINTE ODILE   CCPSO,246701080,44,67
CC du Pays de Salars,CC PAYS DE SALARS,241200658,76,12
CC du Pays de Salers,CC PAYS DE SALERS,241501139,84,15
CC du Pays de Sancey-Belleherbe,CC DU PAYS DE SANCEY-BELLEHERBE,242504371,27,25
CC du Pays de Saverne,CC PAYS DE SAVERNE CCPS,200068112,44,67
CC du Pays de Serres en Quercy,CC PAYS DE SERRES EN QUERCY,200040418,76,82
CC du Pays de Sommières,CC DU PAYS DE SOMMIERES,243000296,76,30
CC du Pays de Stenay et du Val Dunois,CC PAYS STENAY ET VAL DUNOIS,200066132,44,55
CC du Pays de Tarascon,CC DU PAYS DE TARASCON,240900431,76,09
CC du Pays de Trie et du Magnoac,CC PAYS DE TRIE ET MAGNOAC,200070795,76,65
CC du Pays de Tronçais,CC DU PAYS DE TRONCAIS,240300558,84,03
CC du Pays de Valois,CC DU PAYS DE VALOIS,246000871,32,60
CC du Pays de Villeneuve en Armagnac Landais,CC PAYS VILLENEUVE EN ARMAGNAC LANDAIS,244000774,75,40
CC du Pays de Villersexel,CC DU PAYS DE VILLERSEXEL,247000714,27,"25,70"
CC du Pays de Wissembourg,CC PAYS WISSEMBOURG CCPW,246700926,44,67
CC du Pays des Abers,CC DE PLABENNEC ET DES ABERS,242900553,53,29
CC du Pays des Achards,CC DU PAYS DES ACHARDS,248500530,52,85
CC du Pays des Ecrins,CC DU PAYS DES ECRINS,240500462,93,05
CC du Pays des Herbiers,CC DU PAYS DES HERBIERS,248500621,52,85
CC du Pays des Paillons,CC DU PAYS DES PAILLONS,240600593,93,06
CC du Pays des Sorgues et des Monts de Vaucluse,CC PAYS DES SORGUES-ET-MONTS VAUCLUSE,248400319,93,84
CC du Pays des Sources,CC PAYS DES SOURCES,246000855,32,60
CC du Pays du Coquelicot,CC PAYS DU COQUELICOT,248000747,32,80
CC du Pays du Neubourg,CC DU PAYS DU NEUBOURG,242700607,28,27
CC du Pays du Saintois,CC DU PAYS DU SAINTOIS,200035772,44,54
CC du Pays du Sanon,CC DU PAYS DU SANON,245400759,44,54
CC du Pays du Vermandois,CC PAYS DU VERMANDOIS,240200493,32,02
CC du Pays entre Loire et Rhône,CC DU PAYS ENTRE LOIRE ET RHONE,244200630,84,42
CC du Pays Fertois et du Bocage Carrougien,CC PAYS-FERTOIS- BOCAGE-CARROUGIEN,200071652,28,61
CC du Pays Fléchois,CC DU PAYS FLECHOIS,247200348,52,72
CC du Pays Fouesnantais,CC DU PAYS FOUESNANTAIS,242900660,53,29
CC du Pays Foyen,CC PAYS FOYEN,243301371,75,"24,33"
CC du Pays Gentiane,CC PAYS GENTIANE,241500255,84,15
CC du Pays Grenadois,CC DU PAYS GRENADOIS,244000824,75,40
CC du Pays Haut Val d'Alzette,CC PAYS HAUT VAL ALZETTE,245701404,44,"54,57"
CC du Pays Houdanais (C.C.P.H.),CC DU PAYS HOUDANAIS,247800550,"11,24","28,78"
CC du Pays Loudunais,CC DU LOUDUNAIS,248600447,75,86
CC du Pays Morcenais,CC DU PAYS MORCENAIS,244000691,75,40
CC du Pays Mornantais (COPAMO),CC PAYS MORNANTAIS - COPAMO,246900740,84,69
CC du Pays Noyonnais,CC PAYS NOYONNAIS,246000756,32,60
CC du Pays Orne Moselle,CC PAYS ORNE MOSELLE (CCPOM),245701271,44,57
CC du Pays Rethélois,CC DU PAYS RETHELOIS,200043156,44,08
CC du Pays Réuni d'Orange,CC DU PAYS REUNI D'ORANGE,248400236,93,84
CC du Pays Rhénan,CC PAYS RHENAN,200041325,44,67
CC du Pays Rignacois,CC DU PAYS RIGNACOIS,241200625,76,12
CC du Pays Riolais,CC DU PAYS RIOLAIS,247000706,27,70
CC du Pays Rochois,CC DU PAYS ROCHOIS,247400724,84,74
CC du Pays Solesmois,CC SOLESMOIS,245901038,32,59
CC du Pays Tarusate,CC PAYS TARUSATE,244000766,75,40
CC du Pays Viganais,CC DU PAYS VIGANAIS,243000270,76,30
CC du Perche,CC DU PERCHE,200006971,24,28
CC du Perche et Haut Vendômois,CC PERCHE ET HAUT VENDOMOIS,200040772,24,41
CC du Périgord Nontronnais,CC PERIGORD NONTRONNAIS,200071819,75,24
CC du Périgord Ribéracois,CC DU PERIGORD RIBERACOIS,200040400,75,24
CC du Piémont Cévenol,CC PIEMONT CEVENOL,200034411,76,30
CC du Pilat Rhodanien,CC DU PILAT RHODANIEN,244200895,84,42
CC du Pithiverais,CC DU PITHIVERAIS,200066280,24,45
CC du Pithiverais-Gâtinais,CC DU PITHIVERAIS GATINAIS,200071850,24,45
CC du Plateau de Frasne et du Val de Drugeon (CFD),CC PLATEAU DE FRASNE ET VAL DRUGEON,242504496,27,25
CC du Plateau de Lannemezan,CC PLATEAU LANNEMEZAN,200070787,76,65
CC du Plateau de Montbazens,CC PLATEAU DE MONTBAZENS,241200674,76,12
CC du Plateau de Russey,CC DU PLATEAU DU RUSSEY,242504355,27,25
CC du Plateau Picard,CC PLATEAU PICARD,246000566,32,60
CC du Pont du Gard,CC DU PONT DU GARD,243000684,76,30
CC du Provinois,CC DU PROVINOIS (CCDP),200037133,11,77
CC du Quercy Blanc,CC QUERCY BLANC,200039519,76,46
CC du Quercy Caussadais,CC QUERCY CAUSSADAIS,248200057,76,82
CC du Quercy Rouergue et des Gorges de l'Aveyron,CC QUERCY ROUERGUE GORGES AVEYRON,248200107,76,"81,82"
CC du Réolais en Sud Gironde,CC DU REOLAIS EN SUD GIRONDE,200044394,75,33
CC du Réquistanais,CC DU REQUISTANAIS,241200542,76,12
CC du Rhône aux Gorges de l'Ardèche,CC DU RHONE AUX GORGES DE L'ARDECHE,240700864,84,07
CC du Ried de Marckolsheim,CC RIED MARCKOLSHEIM CCRM,200030526,44,"67,68"
CC du Romorantinais et du Monestois,CC DU ROMORANTINAIS ET DU MONESTOIS,200018406,24,41
CC du Rouillacais,CC DU ROUILLACAIS,241600303,75,16
CC du Royans-Vercors,CC ROYANS VERCORS,200067767,84,26
CC du Sammiellois,CC SAMMIELLOIS,245500327,44,55
CC du Sartenais Valinco Taravo,CC DU SARTENAIS VALINCO TARAVO,242010130,94,2A
CC du Saulnois,CC SAULNOIS,245701206,44,57
CC du Saves,CC DU SAVES,243200599,76,32
CC du Secteur de Saint-Loubès,CC SECTEUR SAINT LOUBES,243301249,75,33
CC du Seignanx,CC DU SEIGNANX,244000659,75,40
CC du Serein,CC DU SEREIN,200039709,27,89
CC du Sisteronais-Buëch,CC DU SISTERONAIS-BUECH,200068765,"84,93","04,05,26"
CC du Sor et de l'Agout,CC SOR-ET-AGOUT,248100158,76,81
CC du Sud,CC DU SUD,200060473,06,976
CC du Sud-Artois,CC SUD ARTOIS,200035442,32,62
CC du Sud-Estuaire,CC SUD ESTUAIRE (CCSE),244400586,52,44
CC du Sud Avesnois,CC DU SUD AVESNOIS,200043404,32,59
CC du Sud Corse,CC DU SUD CORSE,200040764,94,2A
CC du Sud Est du Pays Manceau,CC SUD EST PAYS MANCEAU,247200421,52,72
CC du Sud Gironde,CC DU SUD GIRONDE,200043974,75,33
CC du Sud Marnais,CC SUD MARNAIS,245100979,44,51
CC du Sud Messin,CC DU SUD MESSIN,200039907,44,57
CC du Sud Territoire,CC SUD-TERRITOIRE-CCST,249000241,27,90
CC du Ternois,CC DU TERNOIS,200069672,32,"62,80"
CC du Terrassonnais en Périgord Noir Thenon Hautefort,CC TERRASSON PGD NOIR THENON HAUTEFORT,200041150,75,24
CC du Territoire de Fresnes-en-Woëvre,CC FRESNES,245501176,44,55
CC du Territoire de Lunéville à Baccarat,CC TERRIT LUNEVILLE A BACCARAT,200070324,44,54
CC du Territoire Nord Picardie,CC TERRITOIRE NORD PICARDIE,200070951,32,80
CC du Thouarsais,CC DU THOUARSAIS (CCT),247900798,75,79
CC du Triangle Vert,CC DU TRIANGLE VERT,200041861,27,70
CC du Trièves,CC DU TRIEVES,200030658,84,38
CC du Val d'Amboise,CC DU VAL D'AMBOISE,200043065,24,37
CC du Val d'Amour,CC DU VAL D'AMOUR,243900420,27,39
CC du Val d'Argent,CC VAL D'ARGENT,246800395,44,68
CC du Val d'Ay,CC DU VAL D'AY,240700716,84,07
CC du Val d'Essonne (CCVE),CC VAL-D'ESSONNE,249100546,11,91
CC du Val d'Ille-Aubigné,CC DU VAL D'ILLE-AUBIGNE,243500667,53,35
CC du Val d'Orne,CC VAL D'ORNE,246100390,28,61
CC du Val de Bouzanne,CC VAL-DE-BOUZANNE,200018521,24,36
CC du Val de Cher,CC DU VAL DE CHER,240300566,84,03
CC du Val de Drôme en Biovallée,CC DU VAL DE DROME EN BIOVALLEE,242600252,84,26
CC du Val de l'Aisne,CC DU VAL DE L'AISNE,240200501,32,02
CC du Val de l'Eyre,CC DU VAL DE L'EYRE,243301405,75,33
CC du Val de l'Oise,CC DU VAL DE L OISE,200040426,32,02
CC du Val de Morteau,CC VAL DE MORTEAU,242504116,27,25
CC du Val de Sarthe,CC VAL DE SARTHE,247200629,52,72
CC du Val de Somme,CC DU VAL DE SOMME,248000499,32,80
CC du Val de Sully,CC VAL DE SULLY,200070100,24,45
CC du Val de Vienne,CC VAL DE VIENNE,248719288,75,87
CC du Val Marnaysien,CC VAL MARNAYSIEN,200041887,27,"25,70"
CC du Vallespir,CC DU VALLESPIR,246600373,76,66
CC du Vexin-Thelle,CC VEXIN-THELLE,246000707,32,60
CC du Vexin-Val de Seine,CC VEXIN VAL-DE-SEINE,249500513,11,95
CC du Vexin Normand,CC DU VEXIN NORMAND,200071843,28,27
CC du Vimeu,CC VIMEU,200070944,32,80
CC du Volvestre,CC DU VOLVESTRE,200066819,76,31
CC du Warndt,CC WARNDT,245701164,44,57
CC Écueillé-Valençay,CC ECUEILLE - VALENCAY,200040558,24,36
CC Éguzon - Argenton - Vallée de la Creuse,CC EGUZON-ARGENTON-VALLEE DE LA CREUSE,200068872,24,36
CC Élan Limousin Avenir Nature,CC ELAN LIMOUSIN AVENIR NATURE,200066512,75,87
CC Enclave des Papes-Pays de Grignan,CC ENCLAVE DES PAPES PAYS DE GRIGNAN,200040681,"84,93","26,84"
CC Entr'Allier Besbre et Loire,CC ENTR'ALLIER BESBRE ET LOIRE,200071470,84,03
"CC Entre Arroux,Loire et Somme",CC ENTRE ARROUX LOIRE ET SOMME,200070316,27,71
CC Entre Beauce et Perche,CC ENTRE BEAUCE ET PERCHE,200058360,24,28
CC Entre Dore et Allier,CC ENTRE DORE ET ALLIER,246301097,84,63
CC Entre Juine et Renarde (CCEJR),CC JUINE ET RENARDE,249100553,11,91
CC Entre Saône et Grosne,CC ENTRE SAONE ET GROSNE,247103765,27,71
CC Estuaire et Sillon,CC ESTUAIRE ET SILLON,200072734,52,44
CC Falaises du Talou,CC FALAISES DU TALOU,247600729,28,76
CC Faucigny-Glières,CC FAUCIGNY-GLIERES CCFG,200000172,84,74
CC Fercher Pays Florentais,CC FERCHER PAYS FLORENTAIS,241800457,24,18
CC Fier et Usses,CC FIER ET USSES,247400567,84,74
CC Flandre Lys,CC FLANDRES-LYS,245900758,32,"59,62"
"CC Forêts,Lacs,Terres en Champagne",CC FORETS LACS TERRES CHAMPAGNE,241000223,44,10
"CC Forêts,Seine et Suzon",CC FORETS SEINE ET SUZON,200039063,27,21
CC Fumel Vallée du Lot,CC FUMEL VALLEE DU LOT,200068930,75,47
CC Gally Mauldre,CC GALLY MAULDRE,200034130,11,78
CC Gartempe - Saint-Pardoux,CC GARTEMPE-SAINT-PARDOUX,248719262,75,87
CC Gâtinais Val de Loing,CC GATINAIS-VAL DE LOING,200023919,11,77
CC Giennoises,CC GIENNOISES,244500211,24,45
CC Gorges Causses Cévennes,CC GORGES CAUSSES CEVENNES,200069151,76,48
CC Grand-Figeac,CC GRAND FIGEAC 2,200067361,76,"12,46"
CC Grand Orb,CC GRAND ORB CC EN LANGUEDOC,200042646,76,34
CC Grand Sud Tarn et Garonne,CC GRAND SUD TARN ET GARONNE,200066652,76,82
CC Haut-Jura Saint-Claude,CC HAUT JURA - SAINT CLAUDE,200026573,27,39
CC Haut-Léon Communauté,CC HAUT LEON COMMUNAUTE,200067072,53,29
CC Haut Chemin-Pays de Pange,CC HAUT CHEMIN-PAYS DE PANGE,200067957,44,57
CC Haut Limousin en Marche,CC HAUT LIMOUSIN EN MARCHE,200071942,75,87
CC Haut Nivernais-Val d'Yonne,CC HAUT NIVERNAIS VAL D'YONNE,200067429,27,"58,89"
CC Haut Val de Sèvre,CC DU HAUT VAL DE SEVRE (CCHVS),200041994,75,79
CC Haute-Corrèze Communauté,CC HAUTE-CORREZE COMMUNAUTE,200066744,75,"19,23"
CC Haute-Maurienne Vanoise,CC HAUTE MAURIENNE VANOISE,200070340,84,73
CC Haute-Provence-Pays de Banon,CC HAUTE PROVENCE-PAYS DE BANON,200071025,93,04
CC Haute Sarthe Alpes Mancelles,CC HAUTE SARTHE ALPES MANCELLES,200072700,52,72
CC Hautes Terres Communauté,CC HAUTES TERRES COMMUNAUTE,200066637,84,15
CC Houve-Pays Boulageois,CC HOUVE-PAYS BOULAGEOIS,200067650,44,57
CC Inter-Caux-Vexin,CC INTER-CAUX-VEXIN,200070449,28,76
CC Interco Normandie Sud Eure,CC INTERCO NORMANDIE SUD EURE,200066462,"24,28","27,28"
CC Intercom Bernay Terres de Normandie,CC INTERCOM BERNAY TERRES DE NORMANDIE,200066413,28,27
CC Intercom de la Vire au Noireau,CC DE LA VIRE AU NOIREAU,200068799,28,14
CC Interrégionale Aumale - Blangy-sur-Bresle,CC INTERREGIONALE AUMALE-BLANGY-SUR,200069722,"28,32","76,80"
CC Isigny-Omaha Intercom,CC ISIGNY-OMAHA INTERCOM,200066801,28,14
CC Isle-Loue-Auvézère en Périgord,CC ISLE LOUE AUVEZERE EN PERIGORD,242401024,75,24
CC Isle Double Landais,CC ISLE DOUBLE LANDAIS,200040384,75,24
CC Isle et Crempse-en-Périgord,CC ISLE ET CREMPSE EN PERIGORD,200069094,75,24
CC Isle Vern Salembre en Périgord,CC ISLE VERN SALEMBRE EN PERIGORD,200040095,75,24
CC Jabron-Lure-Vançon-Durance,CC JABRON-LURE-VANCON-DURANCE,200071033,"84,93","04,26"
CC Jalle-Eau-Bourde,CC JALLE EAU BOURDE,243301165,75,33
CC Jura Nord,CC JURA NORD,243900560,27,39
"CC Jura Sud,Pays des Lacs,Petite Montagne et Région d'Orgelet",CC PETITE MONTAGNE,200090579,27,39
"CC Jura Sud,Pays des Lacs,Petite Montagne et Région d'Orgelet",CC JURA SUD,200090579,27,39
"CC Jura Sud,Pays des Lacs,Petite Montagne et Région d'Orgelet",CC DU PAYS DES LACS,200090579,27,39
"CC Jura Sud,Pays des Lacs,Petite Montagne et Région d'Orgelet",CC REGION D'ORGELET,200090579,27,39
CC l'Orée de la Brie,CC L'OREE DE LA BRIE,247700644,11,"77,91"
CC La Clayette Chauffailles en Brionnais,CC LA CLAYETTE CHAUFFAILLES EN BRIONNAIS,200070548,27,71
CC La Domitienne,CC LA DOMITIENNE,243400488,76,34
CC La Grandvallière,CC LA GRANDVALLIERE,243900610,27,39
CC La Rochefoucauld - Porte du Périgord,CC LA ROCHEFOUCAULD - PORTE DU PERIGORD,200068914,75,16
CC La Septaine,CC DE LA SEPTAINE,241800374,24,18
CC Lacs et Gorges du Verdon,CC LACS ET GORGES DU VERDON,200040210,93,83
CC Larzac et Vallées,CC LARZAC ET VALLEES,241200906,76,12
CC Latitude Nord Gironde,CC LATITUDE NORD GIRONDE,243301181,75,33
CC Lauragais Revel Sorezois,CC LAURAGAIS-REVEL-SOREZOIS,243100567,76,"11,31,81"
CC Lavalette Tude Dronne,CC LAVALETTE TUDE ET DRONNE,200070282,75,16
CC Le Dourdannais en Hurepoix (CCDH),CC DOURDANNAIS EN HUREPOIX (LE),249100595,11,91
CC Le Dunois,CC DU DUNOIS,241800424,24,18
CC Le Gesnois Bilurien,CC LE GESNOIS BILURIEN,200072684,52,72
CC Le Grand Charolais,CC LE GRAND CHAROLAIS,200071884,"27,84","03,71"
CC Le Grésivaudan,CC LE GRESIVAUDAN,200018166,84,38
CC Le Tonnerrois en Bourgogne,CC LE TONNERROIS EN BOURGOGNE,200039642,27,89
CC Leff Armor Communauté,CC LEFF ARMOR COMMUNAUTE (LAC),200069086,53,22
CC Les Avant-Monts,CC LES AVANTS MONTS,200071058,76,34
CC Les Balcons du Dauphiné,CC LES BALCONS DU DAUPHINE,200068542,84,38
CC Les Bertranges,CC LES BERTRANGES,200068088,"24,27","18,58"
CC Les Portes Briardes entre Villes et Forêts,CC LES PORTES BRIARDES,200023125,11,77
CC Les Portes de l'Ile de France,CC LES PORTES DE L'ILE DE FRANCE,200071074,11,78
CC Les Trois Provinces,CC DES 3 PROVINCES,241800432,24,18
CC Les Vals du Dauphiné,CC LES VALS DU DAUPHINE,200068567,84,38
CC Les Versants d'Aime,CC LES VERSANTS D'AIME,247300817,84,73
CC Lieuvin Pays d'Auge,CC LIEUVIN PAYS D'AUGE,200066017,28,27
CC Liffré-Cormier Communauté,CC LIFFRE-CORMIER COMMUNAUTE,243500774,53,35
CC Loches Sud Touraine,CC LOCHES SUD TOURAINE,200071587,24,37
CC Lodévois et Larzac,CC LODEVOIS ET LARZAC,200017341,76,34
CC Loir-Lucé-Bercé,CC LOIR-LUCE-BERCE,200070373,52,72
CC Loire et Allier,CC LOIRE-ET-ALLIER,245801063,27,58
CC Loire et Semène,CC LOIRE ET SEMENE,244301131,84,43
CC Loire Layon Aubance,CC LOIRE LAYON AUBANCE,200071553,52,49
CC Lot et Tolzac,CC LOT-ET-TOLZAC,244701405,75,47
CC Loudéac Communauté - Bretagne Centre,CC LOUDEAC COMMUNAUTE-BRETAGNE CENTRE,200067460,53,22
CC Loue-Lison,CC LOUE LISON,200068070,27,25
CC Loué - Brûlon - Noyen,CC LOUE-BRULON-NOYEN,200040475,52,72
CC Lyon Saint Exupéry en Dauphiné,CC LYON ST EXUPERY EN DAUPHINE,243800935,84,38
CC Lyons Andelle,CC LYONS ANDELLE,200070142,28,27
CC Mâconnais - Tournugeois,CC MACONNAIS-TOURNUGEOIS,200069698,27,71
CC Mad et Moselle,CC MAD ET MOSELLE,200070738,44,"54,57"
CC Maine Cœur de Sarthe,CC MAINE COEUR DE SARTHE,200068963,52,72
CC Maine Saosnois,CC MAINE SAOSNOIS,200072676,"28,52","61,72"
CC Marche et Combraille en Aquitaine,CC MARCHE COMBRAILLE  AQUITAINE,200067593,75,23
CC Marche Occitane - Val d'Anglin,CC MARCHE OCCITANE VAL D'ANGLIN,200035137,24,36
CC Marches du Velay-Rochebaron,CC MARCHES DU VELAY-ROCHEBARON,200073427,84,43
CC Maremne Adour Côte Sud,CC ADOUR COTE SUD,244000865,75,40
CC Maurienne Galibier,CC MAURIENNE GALIBIER,247300452,84,73
CC Mayenne Communauté,CC MAYENNE COMMUNAUTE,200055887,52,53
CC Méditerranée Porte des Maures,CC MEDITERRANEE PORTE DES MAURES,200027100,93,83
CC Médoc Atlantique,CC MEDOC ATLANTIQUE,200070720,75,33
CC Médoc Cœur de Presqu'île,CC MEDOC COEUR DE PRESQU'ILE,200069995,75,33
CC Médoc Estuaire,CC MEDOC ESTUAIRE,243301447,75,33
CC Médullienne,CC MEDULLIENNE,243301389,75,33
CC Mellois-en-Poitou,CC MELLOIS EN POITOU,200069755,75,79
"CC Meurthe,Mortagne,Moselle",CC MEURTHE MORTAGNE MOSELLE,200067643,44,54
CC Meuse Rognon,CC MEUSE ROGNON,200069664,44,52
CC Mézenc-Loire-Meygal,CC MEZENC-LOIRE-MEYGAL,200073401,84,43
CC Midi Corrézien,CC MIDI CORREZIEN,200066769,75,19
CC Mirebellois et Fontenois,CC MIREBELLOIS ET FONTENOIS,200072825,27,21
CC Mond'Arverne Communauté,CC MOND'ARVERNE COMMUNAUTE,200069177,84,63
CC Mont Lozère,CC MONT LOZERE,200069128,76,"30,48"
CC Montfort Communauté,CC MONTFORT COMMUNAUTE,243500550,53,35
CC Monts d'Arrée Communauté,CC MONTS D'ARREE COMMUNAUTE,200067197,53,29
"CC Monts,Rance et Rougier",CC MONTS RANCE ET ROUGIER,200067163,76,12
CC Moret Seine et Loing,CC MORET SEINE-ET-LOING  CCMSL,247700032,11,77
CC Morvan Sommets et Grands Lacs,CC MORVAN SOMMETS ET GRANDS LACS,200067890,27,58
CC Moselle et Madon,CC MOSELLE ET MADON,245400171,44,54
CC Nebbiu - Conca d'Oro,CC NEBBIU CONCA D'ORO,200073120,94,2B
CC Neste Barousse,CC NESTE BAROUSSE,200070829,76,65
CC Nièvre et Somme,CC NIEVRE ET SOMME,200071223,32,80
CC Norge et Tille,CC NORGE ET TILLE,200069540,27,21
CC Normandie-Cabourg-Pays d'Auge,CC NORMANDIE-CABOURG-PAYS AUGE,200065563,28,14
CC Océan Marais de Monts,CC OCEAN MARAIS DE MONTS,248500258,52,85
CC Orée de Bercé - Belinois,CC OREE DE BERCEE BELINOIS,247200447,52,72
CC Orne Lorraine Confluences,CC ORNE LORRAINE CONFLUENCE,200070845,44,54
CC Osartis Marquion,CC OSARTIS - MARQUION,200044048,32,62
CC Ouche et Montagne,CC OUCHE ET MONTAGNE,200039055,27,21
CC Ouest Aveyron Communauté,CC OUEST AVEYRON COMMUNAUTE,200069383,76,"12,46"
CC Ouest Limousin,CC OUEST LIMOUSIN,200066520,75,87
CC Pasquale Paoli,CC PASQUALE PAOLI,200073138,94,2B
CC Pays d'Apt-Luberon,CC DU PAYS D APT LUBERON,200040624,93,"04,84"
CC Pays d'Évian Vallée d'Abondance,CC PAYS EVIAN VALLEE ABONDANCE,200071967,84,74
CC Pays d'Opale,CC PAYS D'OPALE,200072478,32,62
CC Pays d'Orthe et Arrigans,CC PAYS ORTHE ET ARRIGANS,200069417,75,40
CC Pays d'Uzès,CC PAYS D'UZES,200034379,76,30
CC Pays de Chantonnay,CC DU PAYS DE CHANTONNAY,248500340,52,85
CC Pays de Châteaugiron Communauté,CC PAYS DE CHATEAUGIRON COMMUNAUTE,243500659,53,35
CC Pays de Fontenay-Vendée,CC PAYS DE FONTENAY-VENDEE,200071934,52,85
CC Pays de Montereau,CC PAYS DE MONTEREAU,247700107,11,77
CC Pays de Nay,CC DU PAYS DE NAY,246401756,"75,76","64,65"
CC Pays de Nemours,CC DU PAYS DE NEMOURS,200023240,11,77
CC Pays de Nérondes,CC PAYS DE NERONDES,200007177,24,18
CC Pays de Nexon Monts de Chalus,CC PAYS DE NEXON MONTS DE CHALUS,200070506,75,87
CC Pays des Vans en Cévennes,CC PAYS DES VANS EN CEVENNES,200039832,84,07
CC Pays du Mont-Blanc,CC PAYS DU MONT-BLANC,200034882,84,74
CC Pays Forcalquier et Montagne de Lure,CC PAYS DE FORCALQUIER MONT DE LURE,240400440,93,04
CC Pays Fort Sancerrois Val de Loire,CC PAYS FORT SANCERROIS VAL DE LOIRE,200069227,24,18
CC Pays Rhin - Brisach,CC PAYS RHIN BRISACH,200066025,44,68
CC Pays Ségali Communauté,CC PAYS SEGALI COMMUNAUTE,200068831,76,12
CC Périgord-Limousin,CC PERIGORD LIMOUSIN,242400752,75,24
CC Perthois-Bocage et Der,CC PERTHOIS-BOCAGE ET DER,200042992,44,51
CC Pévèle-Carembault,CC PEVELE CAREMBAULT,200041960,32,59
CC Picardie des Châteaux,CC PICARDIE DES CHATEAUX,200071769,32,02
CC Piège Lauragais Malepère,CC PIEGE LAURAGAIS MALEPERE,200035707,76,11
CC Plaine Limagne,CC PLAINE LIMAGNE,200071199,84,63
CC Plaines et Monts de France,CC PLAINES ET MONTS ET FRANCE,200033090,11,77
CC Plateau de Caux-Doudeville-Yerville,CC PLATEAU DE CAUX-DOUDEVILLE-YERVILLE,200069847,28,76
CC Pleyben-Châteaulin-Porzay,CC PLEYBEN-CHATEAULIN-PORZAY,200067247,53,29
CC Ploërmel Communauté,CC PLOERMEL COMMUNAUTE,200066777,53,56
CC Poher communauté,CC POHER COMMUNAUTE,242900744,53,"22,29"
CC Ponthieu-Marquenterre,CC PONTHIEU-MARQUENTERRE,200070936,32,80
CC Pontivy Communauté,CC PONTIVY COMMUNAUTE,245614433,53,"22,56"
CC Porte d'Aquitaine en Pays de Serres,CC PORTE AQUITAINE EN PAYS DE SERRES,200036572,75,47
CC Porte de Drômardèche,CC PORTE DE DROMARDECHE,200040491,84,"07,26"
CC Porte de Maurienne,CC PORTE DE MAURIENNE,247300676,84,73
CC Porte du Jura,CC PORTE DU JURA,200072056,27,39
CC Porte Océane du Limousin,CC PORTE OCEANE DU LIMOUSIN,200059400,75,87
CC Portes de la Creuse en Marche,CC PORTES CREUSE EN MARCHE,200041556,75,23
CC Portes du Berry entre Loire et Val d'Aubois,CC PORTES DU BERRY ENTRE LOIRE ET VA,200011781,24,18
CC Pré-Bocage Intercom,CC PRE-BOCAGE INTERCOM,200069524,28,14
CC Presqu'île de Crozon-Aulne maritime,CC PRESQU'ILE DE CROZON-AULNE MARITIME,200066868,53,29
CC Provence Verdon,CC PROVENCE VERDON,200040202,93,83
CC Pyrénées Audoises,CC PYRENEES AUDOISES,200043776,76,11
CC Pyrénées catalanes,CC PYRENEES CATALANES,246600464,76,66
CC Pyrénées Cerdagne,CC PYRENEES CERDAGNE,246600399,76,66
CC Pyrénées Haut Garonnaises,CC PYRENEES HAUT GARONNAISES,200072635,76,31
CC Pyrénées Vallées des Gaves,CC PYRENEES VALLEES DES GAVES,200070811,76,65
CC Quercy - Bouriane,CC QUERCY BOURIANE,244600482,76,46
CC Quercy Vert-Aveyron,CC QUERCY VERT-AVEYRON,200066884,76,82
CC Questembert Communauté,CC QUESTEMBERT COMMUNAUTE,245614383,53,56
CC Rahin et Chérimont,CC RAHIN ET CHERIMONT,247000821,27,70
CC Randon - Margeride,CC RANDON MARGERIDE,200069102,76,48
"CC Région Lézignanaise,Corbières et Minervois",CC REGION LEZIGNANAISE CORBIERES MINERVO,200035863,76,11
CC Retz-en-Valois,CC RETZ EN VALOIS,200071991,32,02
CC Rhône Crussol,CC RHONE-CRUSSOL,200041366,84,07
CC Rhône Lez Provence,CC RHONE-LEZ-PROVENCE,200000628,93,84
"CC Rhony,Vistre,Vidourle",CC RHONY VISTRE VIDOURLE,243000569,76,30
CC Rives de l'Ain - Pays du Cerdon,CC RIVES AIN PAYS CERDON,200029999,84,01
CC Rives de Moselle,CC RIVES DE MOSELLE,200039949,44,57
CC Rives de Saône,CC RIVES SAONE SAINT-JEAN SEURRE,242101509,27,21
CC Roche aux Fées Communauté,ROCHE AUX FEES COMMUNAUTE,243500634,53,35
CC Roi Morvan Communauté,CC ROI MORVAN COMMUNAUTE,245614417,53,56
CC Roumois Seine,CC ROUMOIS-SEINE,200066405,28,"27,76"
CC Roussillon-Conflent,CC ROUSSILLON CONFLENT,246600415,76,66
CC Rumilly Terre de Savoie,CC RUMILLY TERRE DE SAVOIE,247400740,84,74
CC Rurales de l'Entre-deux-Mers,CC RURALES DE L'ENTRE 2 MERS,200069599,75,33
CC Saint-Flour Communauté,CC SAINT-FLOUR COMMUNAUTE,200066660,84,15
CC Saint-Marcellin Vercors Isère Communauté,CC ST MARCELLIN VERCORS ISERE,200070431,84,38
CC Saint-Pourçain Sioule Limagne,CC SAINT POURCAIN SIOULE LIMAGNE,200071389,84,03
"CC Saint Affricain,Roquefort,Sept Vallons",CC SAINT AFFRICAIN ROQUEFORT SEPT VALLON,200067155,76,12
CC Saint Cyr Mère Boitier entre Charolais et Mâconnais,CC ST CYR MERE BOITIER CHAROLAIS MACONNA,200071645,27,71
CC Saône-Beaujolais,CC SAONE BEAUJOLAIS - CCSB,200067817,84,69
CC Saône Doubs Bresse,CC SAONE DOUBS BRESSE,200040038,27,71
CC Sarlat-Périgord Noir,CC SARLAT-PERIGORD NOIR,200027217,75,24
CC Sarrebourg Moselle Sud,CC SARREBOURG-MOSELLE SUD,200068146,44,57
CC Sauer-Pechelbronn,CC SAUER PECHELBRONN CCSP,200013050,44,67
CC Sauldre et Sologne,CC SAULDRE ET SOLOGNE,200000933,24,18
CC Sausseron Impressionnistes,CC SAUSSERON IMPRESSIONNISTES,249500430,11,95
CC Seine et Aube,CC SEINE ET AUBE,200070126,44,10
CC Senlis Sud Oise,CC SENLIS SUD OISE,200066975,32,60
CC Serein et Armance,CC SEREIN ET ARMANCE,200067304,27,89
CC Serre-Ponçon,CC SERRE-PONCON,200067742,93,"04,05"
CC Serre-Ponçon Val d'Avance,CC SERRE-PONCON VAL D'AVANCE,200067320,93,"04,05"
CC Seulles Terre et Mer,CC SEULLES TERRE MER,200069516,28,14
CC Sèvre et Loire,CC SEVRE ET LOIRE (CCSL),200067866,52,44
CC Sidobre Vals et Plateaux,CC SIDOBRE VALS ET PLATEAUX,200066561,76,81
CC Somme Sud-Ouest,CC SOMME SUD OUEST,200071181,32,80
CC Spelunca-Liamone,COM COM SPELUNCA LIAMONE,200067049,94,2A
CC Sud-Hérault,CC SUD-HERAULT,200042653,76,34
CC Sud-Roussillon,CC SUD ROUSSILLON,246600282,76,66
CC Sud Alsace Largue,CC SUD ALSACE  LARGUE,200066033,44,68
CC Sud Côte Chalonnaise,CC SUD COTE CHALONNAISE,247104094,27,71
CC Sud Nivernais,CC SUD NIVERNAIS,200067700,27,58
CC Sud Retz Atlantique,CC SUD RETZ ATLANTIQUE - CCSRA,200071546,52,44
CC Sud Sarthe,CC SUD SARTHE,200073112,52,72
CC Sud Vendée Littoral,CC SUD VENDEE LITTORAL,200073260,52,85
CC Sumène - Artense,CC SUMENE ARTENSE,241501055,84,15
CC Sundgau,CC SUNDGAU,200066041,44,68
CC Tannay-Brinon-Corbigny,CC TANNAY BRINON CORBIGNY,200067692,27,58
CC Tarn-Agout,CC TARN-AGOUT,200034023,76,"31,81"
CC Terre d'Auge,CC TERRE D AUGE,241400878,28,14
CC Terre d'Eau,CC TERRE EAU,200068682,44,88
CC Terre de Camargue,CC TERRES DE CAMARGUE,243000650,76,30
CC Terre de Picardie,CC TERRE DE PICARDIE,200070928,32,80
CC Terre Lorraine du Longuyonnais,CC TERRE LORRAINE DU LONGUYONNAIS,200043693,44,54
"CC Terres-de-Montaigu,communauté de communes Montaigu-Rocheservière",CC TERRES DE MONTAIGU CCMR,200070233,52,85
CC Terres de Bresse,CC TERRES DE BRESSE,200071538,27,71
CC Terres de Chalosse,CC TERRES DE CHALOSSE,200069631,75,40
CC Terres de Perche,CC TERRES DE PERCHE,200070167,24,28
CC Terres de Saône,CC TERRES DE SAONE,200041879,27,70
CC Terres des Confluences,CC TERRES DES CONFLUENCES,200066322,76,82
CC Terres du Haut Berry,CC TERRES DU HAUT BERRY,200066330,24,18
CC Terres Touloises,CC TERRES TOULOISES,200070563,44,54
CC Territoriale Sud-Luberon,CC TERRITORIALE SUD LUBERON COTELUB,248400285,93,84
CC Terroir de Caux,CC TERROIR DE CAUX,200068534,28,76
