nom,nom_minimise,SIREN,code_region,code_departement
CC de Desvres-Samer,CC DESVRES-SAMER,200018083,32,62
CC de Domme - Villefranche du Périgord,CC DOMME VILLEFRANCHE DU PERIGORD,200041440,75,24
CC de Fium'orbu Castellu,CC DE FIUM'ORBU CASTELLU,200033827,94,2B
CC de Flandre Intérieure,CC DE FLANDRE INTERIEURE,200040947,32,59
CC de Forez-Est,CC FOREZ EST,200065894,84,42
CC de Freyming-Merlebach,CC FREYMING-MERLEBACH,245700398,44,57
CC de Gâtine et Choisilles - Pays de Racan,CC GATINE ET CHOISILLES PAYS DE RACAN,200073237,24,37
CC de Gémozac et de la Saintonge Viticole,CDC GEMOZAC SAINTONGE VITICOLE,241700632,75,17
CC de Gevrey-Chambertin et de Nuits-Saint-Georges,CC GEVREY CHAMBERTIN NUITS ST GEORGES,200070894,27,21
CC de Grand Lieu,CC GRANDLIEU  (CCGL),244400438,52,44
"CC de Granville,Terre et Mer",CC GRANVILLE TERRE ET MER,200042604,28,50
CC de Hanau-La Petite Pierre,CC HANAU LA PETITE PIERRE CCHLPP,200067783,44,67
CC de Haute-Cornouaille,CC DE HAUTE CORNOUAILLE,242900561,53,29
CC de Haute-Tarentaise,CC HAUTE TARENTAISE,247300254,84,73
CC de l'Agglomération Migennoise,CC AGGLOMERATION MIGENNOISE,248900383,27,89
CC de l'Aillantais,CC DE L'AILLANTAIS,248900524,27,89
CC de l'Aire à l'Argonne,CC DE L'AIRE A L'ARGONNE,200066140,44,55
CC de l'Aire Cantilienne,CC AIRE CANTILIENNE,246000764,32,60
CC de l'Alsace Bossue,CC ALSACE BOSSUE  CCAB,200067841,44,67
CC de l'Alta Rocca,CC ALTA ROCCA,242000495,94,2A
CC de l'Arc Mosellan,CC ARC MOSELLAN,245701354,44,57
CC de l'Argonne Ardennaise,CC ARGONNE ARDENNAISE,240800920,44,08
CC de l'Argonne Champenoise,CC ARGONNE CHAMPENOISE,200042703,44,51
CC de l'Ernée,CC L'ERNEE,245300355,52,53
CC de l'Est de la Somme,CC EST DE LA SOMME,200070985,32,"02,80"
CC de l'Est Guyanais,CC EST GUYANAIS (CCEG),249730052,03,973
CC de l'Est Lyonnais (CCEL),CC EST LYONNAIS - CCEL,246900575,84,69
CC de l'Estuaire,CC DE L'ESTUAIRE,243300811,75,33
CC de l'Île-Rousse - Balagne,CC DE L'ILE ROUSSE BALAGNE,200073104,94,2B
CC de l'Île d'Oléron,CC ILE D'OLERON,241700624,75,17
CC de l'Île de Noirmoutier,CC DE L'ILE DE NOIRMOUTIER,248500191,52,85
CC de l'Île de Ré,CC ILE-DE-RE,241700459,75,17
CC de l'Oisans,CC DE L'OISANS,243800745,84,38
CC de l'Oise Picarde,CC OISE PICARDE,200068005,32,60
CC de l'Oriente,CC DE L ORIENTE,200015162,94,2B
CC de l'Orvin et de l'Ardusson,CC ORVIN ET ARDUSSON,241000488,44,10
CC de l'Ouest Guyanais,CC OUEST GUYANAIS,249730037,03,973
CC de l'Ouest Vosgien,CC OUEST VOSGIEN,200068559,44,"52,88"
CC de l'Oust à Brocéliande,CC DE L OUST A BROCELIANDE CCDOBC,200066785,53,56
CC de l'Outre-Forêt,CC OUTRE FORET,200040178,44,67
CC de la Baie du Cotentin,CC BAIE DU COTENTIN,200042729,28,50
CC de la Basse-Zorn,CC BASSE ZORN CCBZ,246700843,44,67
CC de la Beauce Loirétaine,CC BEAUCE LOIRETAINE,200035764,24,45
CC de la Brie Champenoise,CC DE LA BRIE CHAMPENOISE,245100888,44,51
CC de la Castagniccia-Casinca,CC DE LA CASTAGNICCIA CASINCA,200073252,94,2B
CC de la Champagne Conlinoise et du Pays de Sillé,CC CCPS,200072718,52,72
CC de la Champagne Picarde,CC CHAMPAGNE PICARDE,240200576,32,02
CC de la Châtaigneraie Cantalienne,CC CHATAIGNERAIE CANTALIENNE,200066678,84,15
CC de la Châtre et Sainte-Sévère,CC LA CHATRE SAINTE-SEVERE-SUR-INDRE,243600350,24,36
"CC de la Cléry,du Betz et de l'Ouanne",CC CLERY DU BETZ ET DE OUANNE,200067668,"24,27","45,89"
CC de la Costa Verde,CC DE LA COSTA VERDE,200034205,94,2B
CC de la Côte d'Albâtre,CC COTE D'ALBATRE,200069839,28,76
CC de la Côtière à Montluel,CC DE LA COTIERE A MONTLUEL,240100610,84,01
CC de la Dombes,CC DOMBES,200069193,84,01
CC de la Forêt,CC LA FORET NEUVILLE,244500484,24,45
CC de la Gascogne Toulousaine,CC GASCOGNE TOULOUSAINE,200023620,76,"31,32"
CC de la Grande Vallée de la Marne,CC DE LA GRANDE VALLEE DE LA MARNE,245100615,44,51
CC de la Haute-Bigorre,CC HAUTE-BIGORRE,246500482,76,65
CC de la Haute-Deûle,CC LA HAUTE DEULE,245901061,32,59
CC de la Haute-Saintonge,CC HAUTE SAINTONGE,200041523,75,17
CC de la Haute-Somme,CC HAUTE SOMME,200037059,32,80
CC de la Haute Ariège,CC DE LA HAUTE ARIEGE,200066363,76,09
CC de la Haute Comté,CC DE LA HAUTE COMTE,200041721,27,70
CC de la Haute Vallée de Chevreuse,CC HAUTE VALLEE DE CHEVREUSE,200033173,11,78
CC de la Lomagne Gersoise,CC LOMAGNE GERSOISE,243200391,76,32
CC de la Lomagne Tarn-et-Garonnaise,CC LOMAGNE TARN ET GARONNAISE,248200065,76,82
CC de la Marche Berrichonne,CC MARCHE BERRICHONNE,200007052,24,36
CC de la Matheysine,CC DE LA MATHEYSINE,200040657,84,38
CC de la Moivre à la Coole,CC DE LA MOIVRE A LA COOLE,200043438,44,51
CC de la Montagne d'Ardèche,CC DE LA MONTAGNE D'ARDECHE,200072007,84,07
CC de la Montagne Noire,CC DE LA MONTAGNE NOIRE,200042463,76,11
CC de la Mossig et du Vignoble,CC MOSSIG ET VIGNOBLE,200068864,44,67
CC de la Muse et des Raspes du Tarn,CC MUSE ET RASPES DU TARN,241200914,76,12
CC de la Picardie Verte,CC PICARDIE VERTE,246000848,32,60
CC de la Piève de l'Ornano et du Taravo,COMMUNAUTE COMMUNES PIEVE D'ORNANO,200038958,94,2A
CC de la Plaine d'Estrées,CC PLAINE D'ESTREES,246000897,32,60
CC de la Plaine de l'Ain,CC PLAINE DE L'AIN,240100883,84,01
CC de la Plaine Dijonnaise,CC PLAINE DIJONNAISE,200000925,27,21
CC de la Plaine du Nord Loiret,CC PLAINE DU NORD LOIRET,244500542,24,45
CC de la Plaine du Rhin,CC PLAINE RHIN,200041283,44,67
CC de la Plaine Jurassienne,CC PLAINE JURASSIENNE,243901089,27,39
CC de la Porte des Vosges Méridionales,CC PVM,200068377,44,88
CC de la Région d'Audruicq,CC REGION AUDRUICQ,246200844,32,62
CC de la Région de Bar-sur-Aube,CC BAR-SUR-AUBE,241000405,44,10
CC de la Région de Blain,CC BLAIN,244400453,52,44
CC de la Région de Guebwiller,CC REGION GUEBWILLER,246800569,44,68
CC de la Région de Levroux,CC LEVROUX,243600293,24,36
CC de la Région de Molsheim-Mutzig,CC MOLSHEIM MUTZIG   CCMM,246701064,44,67
CC de la Région de Rambervillers,CC RAMBERVILLERS,200005957,44,88
CC de la Région de Suippes,CC REGION DE SUIPPES,200042620,44,51
CC de la Save au Touch,CC DE LA SAVE AU TOUCH,243100781,76,31
CC de la Sologne des Étangs,CC SOLOGNE DES ETANGS,244100780,24,41
CC de la Sologne des Rivières,CC SOLOGNE DES RIVIERES,244100806,24,41
CC de la Station des Rousses-Haut Jura,CC STATION ROUSSES,243900354,27,39
CC de la Tenarèze,CC LA TENAREZE,243200417,76,32
CC de la Terre des Deux Caps,CC DE LA TERRE DES 2 CAPS,246200380,32,62
CC de la Thiérache du Centre,CC THIERACHE DU CENTRE,240200444,32,02
CC de la Vallée d'Ossau,CC DE LA VALLEE D OSSAU,246400337,75,64
CC de la Vallée de Chamonix-Mont-Blanc,CC DE LA VALLEE DE CHAMONIX-MONT-BLANC,200023372,84,74
CC de la Vallée de Kaysersberg,CC VALLEE KAYSERSBERG,246800551,44,68
CC de la Vallée de l'Homme,CC VALLEE DE L HOMME,200041168,75,24
CC de la Vallée de l'Oise et des Trois Forêts,CC VALLEE OISE TROIS FORETS,249500455,11,95
CC de la Vallée de la Bruche,CC VALLEE-BRUCHE CCVB,246700306,44,67
CC de la Vallée de la Doller et du Soultzbach,CC VALLEE DOLLER SOULTZBACH,246800676,44,68
CC de la Vallée de la Haute-Sarthe,CC VALLEE DE LA HAUTE SARTHE,200035103,28,61
CC de la Vallée de Munster,CC VALLEE MUNSTER,246800585,44,68
CC de la Vallée de Saint-Amarin,CC VALLEE SAINT AMARIN,246800205,44,68
CC de la Vallée de Villé,CC VALLEE DE VILLE     CCVV,246700777,44,67
CC de la Vallée du Gapeau,CC VALLEE DU GAPEAU,248300410,93,83
CC de la Vallée du Garon (CCVG),CC VALLEE DU GARON - CCVG,246900757,84,69
CC de la Vallée du Lot et du Vignoble,CC VALLEE LOT ET VIGNOBLE,244600433,76,46
CC de la Vallée Verte,CC DE LA VALLEE VERTE,247400047,84,74
CC de la Vanne et du Pays d'Othe,CC DE LA VANNE ET PAYS D'OTHE,248900664,27,89
CC de la Veyle,CC DE LA VEYLE,200070555,84,01
CC de Lacq-Orthez,CC LACQ-ORTHEZ,200039204,75,64
CC de Lévézou Pareloup,CC LEVEZOU PARELOUP,241200765,76,12
CC de Londinières,CC LONDINIERES,247600604,28,76
CC de Marana-Golo,CC DE MARANA GOLO,200036499,94,2B
CC de Marcigny,CC DE MARCIGNY,247100639,27,71
CC de Marie-Galante,CC MARIE GALANTE,249710047,01,971
CC de Millau Grands Causses,CC MILLAU GRANDS CAUSSES,241200567,76,"12,48"
CC de Mimizan,CC MIMIZAN,244000543,75,40
CC de Mirecourt Dompaire,CC MIRECOURT DOMPAIRE,200068369,44,88
CC de Miribel et du Plateau,CC MIRIBEL ET PLATEAU,240100800,84,01
CC de Montaigne Montravel et Gurson,CC MONTAIGNE MONTRAVEL ET GURSON,200034197,75,24
CC de Montbenoît,CC CANTON MONTBENOIT,242500320,27,25
CC de Montesquieu,CC MONTESQUIEU,243301264,75,33
CC de Noblat,CC DE NOBLAT,248719361,75,87
CC de Nozay,CC REGION NOZAY,244400537,52,44
CC de Parthenay-Gâtine,CC DE PARTHENAY-GATINE (CCPG),200041333,75,79
CC de Petite-Terre,CC PETITE TERRE,200050532,06,976
CC de Petite Camargue,CC PETITE CAMARGUE,243000593,76,30
CC de Pont-Audemer / Val de Risle,CC DE PONT-AUDEMER / VAL-DE-RISLE,200065787,28,27
CC de Portes Sud Périgord,CC PORTES SUD PERIGORD,200040889,75,24
CC de Pouilly-en-Auxois/Bligny-sur-Ouche,CC POUILLY BLIGNY,200071207,27,21
CC de Puisaye-Forterre,CC PUISAYE FORTERRE,200067130,27,"58,89"
CC de Sablé-sur-Sarthe,CC DE SABLE SUR SARTHE,247200090,52,"53,72"
CC de Saint-Méen Montauban,CC ST MEEN MONTAUBAN,200038990,53,35
CC de Saulieu,CC SAULIEU,242101442,27,21
CC de Seille et Grand Couronné,CC SEILLE ET GRAND COURONNE,200070589,44,54
CC de Sélestat,CC SELESTAT   CCS,246700967,44,67
CC de Sézanne-Sud Ouest Marnais,CC DE SEZANNE-SUD OUEST MARNAIS,200066835,44,51
CC de Thann-Cernay,CC THANN-CERNAY,200036465,44,68
CC de Val'Aïgo,CC VAL'AIGO,243100773,76,31
CC de Vendeuvre-Soulaines,CC VENDEUVRE-SOULAINES,200066892,44,10
CC de Ventadour - Egletons - Monédières,CC VENTADOUR-EGLETONS-MONEDIERES,241900133,75,19
CC de Vezouze en Piémont,CC DE VEZOUZE EN PIEMONT,200069433,44,54
CC de Vie et Boulogne,CC VIE ET BOULOGNE,200072882,52,85
CC de Villedieu Intercom,CC VILLEDIEU INTERCOM,200043354,28,50
"CC de Vitry,Champagne et Der",CC VITRY CHAMPAGNE ET DER,200034718,44,51
CC de Yenne,CC YENNE,247300262,84,73
CC Decazeville Communauté,CC DECAZEVILLE COMMUNAUTE,200067064,76,12
CC des 1000 étangs,CC DES 1000 ETANGS,247000854,27,70
CC des 4B Sud Charente,CC DES 4B SUD CHARENTE,200029734,75,16
"CC des Albères,de la Côte Vermeille et de l'Illibéris",CC DES ALBERES COTE VERMEILLE ILLIBERIS,200043602,76,66
CC des Aspres,CC DES ASPRES,246600449,76,66
CC des Ballons des Hautes-Vosges,CC BALLONS HAUTES VOSGES,200033868,44,88
CC des Baronnies en Drôme Provençale,CC BARONNIES DROME PROVENCALE,200068229,84,26
CC des Bastides Dordogne-Périgord,CC BASTIDES DORDOGNE PERIGORD,200034833,75,24
CC des Bastides en Haut-Agenais Périgord,CC BASTIDES HAUT AGENAIS PERIGORD,200036523,75,47
CC des Campagnes de l'Artois,CC DES CAMPAGNES DE L'ARTOIS,200069482,32,62
CC des Causses à l'Aubrac,CC DES CAUSSES A L'AUBRAC,200068484,76,12
CC des Cévennes au Mont Lozère,CC CEVENNES AU MONT LOZERE,200069136,76,48
CC des Cévennes Gangeoises et Suménoises,CC CEVENNES GANGEOISES SUMENOISES,243400736,76,"30,34"
CC des Coëvrons,CC COEVRONS,200033298,52,53
CC des Collines du Nord Dauphiné,CC COLLINES NORD DAUPHINE,243801255,84,38
CC des Collines du Perche,CC DES COLLINES DU PERCHE,244100293,24,41
CC des Collines du Perche Normand,CC COLLINES DU PERCHE NORMAND,200071504,28,61
CC des Combes,CC DES COMBES,247000367,27,70
CC des Coteaux Arrats Gimone,CC COTEAUX ARRATS GIMONE,200042372,76,32
CC des Coteaux Bellevue,CC COTEAUX DE BELLEVUE,243100815,76,31
CC des Coteaux Bordelais,CC COTEAUX BORDELAIS,243301355,75,33
CC des Coteaux du Girou,CC DES COTEAUX DU GIROU,243100732,76,31
CC des Coteaux du Val-d'Arros,CC VAL D'ARROS,200070803,76,65
CC des Coteaux et Landes de Gascogne,CC DES COTEAUX ET LANDES DE GASCOGNE,244701355,75,47
CC des Crêtes Préardennaises,CC CRETES PREARDENNAISES,240800862,44,08
CC des Deux Morin,CC DES DEUX MORIN,200072544,11,77
CC des Deux Rives,CC DES DEUX RIVES,248200016,"75,76","32,47,82"
CC des Deux Vallées,CC DES 2 VALLEES,246000772,32,60
CC des Deux Vallées,CC DES 2 VALLEES CC2V,249100157,11,91
CC des Deux Vallées Vertes,CC DES DEUX VALLEES VERTES,200068294,27,25
CC des Forêts du Perche,CC DES FORETS DU PERCHE,200069912,24,28
CC des Gorges de l'Ardèche,CC DES GORGES DE L ARDECHE,200039808,84,07
CC des Grands Lacs,CC DES GRANDS LACS,244000873,75,40
CC des Hautes-Vosges,CC HAUTES VOSGES,200071157,44,88
CC des Hautes Terres de l'Aubrac,CC HAUTES TERRES DE L AUBRAC,200069144,76,48
CC des Hauts de Flandre,CC DES HAUTS DE FLANDRE,200040954,32,59
CC des Hauts du Perche,CC DES-HAUTS-DU-PERCHE,200068856,28,61
CC des Hauts du Val de Saône,CC DES HAUTS DU VAL DE SAONE,200036150,27,70
CC des Hauts Tolosans,CC DES HAUTS TOLOSANS,200071314,76,31
CC des Lacs de Champagne,CC DES LACS EN CHAMPAGNE,200040137,44,10
CC des Lacs et Montagnes du Haut-Doubs,CC DES LACS ET MONTAGNES DU HAUT-DOUBS,200069565,27,25
CC des Landes d'Armagnac,CC DES LANDES D'ARMAGNAC,200035541,75,40
CC des Lisières de l'Oise,CC DES LISIERES DE L'OISE,246000749,32,60
CC des Loges,CC DES LOGES JARGEAU,244500427,24,45
CC des Luys en Béarn,CC DES LUYS EN BEARN,200067239,75,64
CC des Montagnes du Giffre,CC DES MONTAGNES DU GIFFRE,200034098,84,74
CC des Monts d'Alban et du Villefranchois,CC MONTS D'ALBAN ET VILLEFRANCHOIS,200034031,76,81
CC des Monts de Gy,CC DES MONTS DE GY,247000698,27,70
CC des Monts de Lacaune et de la Montagne du Haut Languedoc,CC MONTS LACAUNE MONTAGNE HT LANGUEDOC,200066553,76,"34,81"
CC des Monts du Lyonnais,CC MONTS DU LYONNAIS - CCML,200066587,84,"42,69"
CC des Monts du Pilat,CC DES MONTS DU PILAT,244200622,84,42
CC des Pays d'Oise et d'Halatte,CC PAYS OISE ET HALATTE,246000921,32,60
CC des Pays de Cayres et de Pradelles,CC DES PAYS CAYRES PRADELLES,244301123,84,43
CC des Pays de L'Aigle,CC DES PAYS DE L'AIGLE,200068468,28,61
CC des Pays du Sel et du Vermois,CC PAYS DU SEL ET DU VERMOIS,245400189,44,54
CC des Paysages de la Champagne,CC DES PAYSAGES DE LA CHAMPAGNE,200066850,44,51
CC des Portes d'Ariège Pyrénées,CC DES PORTES D'ARIEGE-PYRENEES,200066231,76,09
CC des Portes de l'Entre-deux-Mers,CC PORTES ENTRE 2 MERS,243301439,75,33
CC des Portes de la Thiérache,CC PORTES DE LA THIERACHE,240200634,32,02
CC des Portes de Meuse,CC PORTES DE MEUSE,200066108,44,55
CC des Portes de Romilly-sur-Seine,CC PORTES ROMILLY,200000545,44,10
CC des Portes de Rosheim,CC PORTES DE ROSHEIM,246700744,44,67
CC des Portes de Sologne,CC DES PORTES DE SOLOGNE,200005932,24,45
CC des Portes de Vassivière,CC PORTES DE VASSIVIERE,248719353,75,87
CC des Portes du Haut-Doubs,CC DES PORTES DU HAUT-DOUBS,242504181,27,25
CC des Portes du Luxembourg,CC DES PORTES DU LUXEMBOURG,240800847,44,08
CC des Portes Euréliennes d'Île-de-France,CC PTES EURELIENNES ILE FRANCE,200069953,24,28
CC des Quatre Rivières,CC DES 4 RIVIERES,200069730,28,"27,76"
CC des Quatre Rivières,CC DES 4 RIVIERES,247000623,27,70
CC des Quatre Rivières,CC DES QUATRE-RIVIERES,247400666,84,74
CC des Quatre Vallées,CC QUATRE VALLEES FERRIERES,244500419,24,45
CC des Rives du Haut-Allier,CC DES RIVES DU HAUT ALLIER,200073393,84,43
CC des Sablons,CC SABLONS,246000582,32,60
CC des Savanes,CC DES SAVANES,200027548,03,973
CC des Savoir-Faire,CC DES SAVOIR-FAIRE,200070332,"27,44","52,70"
CC des Sept Vallées,CC 7 VALLEES COMM,200044030,32,62
CC des Sorgues du Comtat,CC LES SORGUES DU COMTAT MONTEUX,248400293,93,84
CC des Sources de l'Orne,CC DES SOURCES DE L'ORNE,200035111,28,61
CC des Sources du Lac d'Annecy,CC SOURCES DU LAC D'ANNECY,247400773,84,74
CC des Sucs,CC DES SUCS,244301016,84,43
CC des Terres d'Apcher-Margeride-Aubrac,CC TERRES D APCHER MARGERIDE AUBRAC,200069185,76,48
CC des Terres d'Auxois,CC DES TERRES D'AUXOIS,200071017,27,21
CC des Terres du Lauragais,CC DES TERRES DU LAURAGAIS,200071298,76,31
CC des Terres du Val de Loire,CC TERRES DU VAL DE LOIRE,200070183,24,"41,45"
CC des Trois Forêts,CC DES TROIS FORETS,245200597,44,52
CC des Trois Rivières,CC DU PAYS TROIS RIVIERES,240200600,32,02
CC des Vallées d'Aigueblanche,CC VALLEES AIGUEBLANCHE,247300015,84,73
CC des Vallées d'Auge et du Merlerault,CC VALLEES-D-AUGE-MERLERAULT,200069458,28,61
CC des Vallées de la Braye et de l'Anille,CC VALLEES BRAYE ET ANILLE,200072692,52,72
CC des Vallées de la Tille et de l'Ignon,CC VALLEES TILLE IGNON,242100154,27,21
CC des Vallées de Thônes,CC DES VALLEES DE THONES (CCVT),247400617,84,74
CC des Vallées du Clain,CC DES  VALLEES DU CLAIN,200043628,75,86
CC des Vallées du Haut-Anjou,CC VALLEES DU HAUT-ANJOU,200071868,52,49
CC des Vallons du Lyonnais (CCVL),CC VALLONS DU LYONNAIS - CCVL,246900724,84,69
CC des Vals d'Aix et Isable,CC DES VALS D'AIX ET ISABLE,244200614,84,42
CC des Vals de Saintonge Communauté,CC VALS DE SAINTONGE,200041689,75,17
CC des Villes Sœurs,CC DES VILLES SOEURS,247600588,"28,32","76,80"
CC des Vosges côté Sud Ouest,CC COTE SUD OUEST,200068773,44,88
CC des Vosges du Sud,CC VOSGES DU SUD,200069060,27,90
CC Dieulefit-Bourdeaux,CC DIEULEFIT-BOURDEAUX,242600492,84,26
CC Dombes Saône Vallée,CC DOMBES SAONE VALLEE,200042497,84,01
CC Dômes Sancy Artense,CC DOMES SANCY ARTENSE,200069169,84,63
CC Domfront Tinchebray Interco,CC DOMFRONT-TINCHEBRAY-INTERC,200071520,28,61
CC Douarnenez Communauté,CC DOUARNENEZ COMMUNAUTE,242900645,53,29
CC Drôme Sud Provence,CC DROME SUD PROVENCE,200042901,84,26
CC Dronne et Belle,CC DRONNE ET BELLE,200041572,75,24
CC du Barséquanais en Champagne,CC BARSEQUANAIS EN CHAMPAGNE,200069003,44,10
CC du Bas Armagnac,CC BAS ARMAGNAC,243200409,76,32
CC du Bassin d'Aubenas,CC BASSIN D AUBENAS,200073245,84,07
CC du Bassin de Joinville en Champagne,CC DU BASSIN DE JOINVILLE EN CHAMPAGNE,200044253,44,52
CC du Bassin de Marennes,CC MARENNES,241700699,75,17
CC du Bassin de Pompey,CC BASSIN DE POMPEY,245400601,44,54
CC du Bassin de Pont-à-Mousson,CC DU BASSIN DE PONT-A-MOUSSON,200041515,44,54
CC du Bazadais,CC DU BAZADAIS,200043982,75,33
CC du Béarn des Gaves,CC DU BEARN DES GAVES,200067288,75,64
CC du Bocage Bourbonnais,CC DU BOCAGE BOURBONNAIS,200071496,84,03
CC du Bocage Mayennais,CC BOCAGE MAYENNAIS,245300389,52,53
CC du Bonnevalais,CC DU BONNEVALAIS,242852465,24,28
CC du Briançonnais,CC DU BRIANCONNAIS,240500439,93,05
CC du Canton d'Erstein,CC CANTON ERSTEIN CCCE,200067924,44,67
CC du Canton d'Oulchy-le-Château,CC CANTON OULCHY-LE-CHATEAU,240200519,32,02
CC du Canton de Charly-sur-Marne,CC CANTON DE CHARLY,240200584,32,02
CC du Canton de la Chambre,CC CANTON DE LA CHAMBRE,247300361,84,73
CC du Canton de Semur-en-Brionnais,CC SEMUR-EN-BRIONNAIS,247103864,27,71
CC du Cap Corse,CC DU CAP CORSE,200042943,94,2B
CC du Castelrenaudais,CC DU CASTELRENAUDAIS,243700499,24,37
CC du Causse de Labastide-Murat,CC CAUSSE LABASTIDE-MURAT,244600573,76,46
CC du Centre-Ouest,CC DU CENTRE OUEST,200059871,06,976
CC du Centre Corse,CC DU CENTRE CORSE,242020071,94,2B
CC du Centre du Haut-Rhin,CC CENTRE HAUT-RHIN,246800445,44,68
CC du Chaourçois et du Val d'Armance,CC CHAOURCOIS ET VAL D'ARMANCE,200071041,44,10
CC du Châtillonnais en Berry,CC DU CHATILLONNAIS EN BERRY,200035848,24,36
CC du Chemin des Dames,CC DU CHEMIN DES DAMES,240200592,32,02
CC du Civraisien en Poitou,CC DU  CIVRAISIEN EN POITOU,200070035,75,86
CC du Clermontais,CC DU CLERMONTAIS,243400355,76,34
CC du Clermontois,CC PAYS CLERMONTOIS,246000376,32,60
CC du Clunisois,CC DU CLUNISOIS,200040293,27,71
CC du Confluent et des Coteaux de Prayssas,CC CONFLUENT ET COT PRAYSSAS,200068922,75,47
CC du Cordais et du Causse (4 C),CC CORDAIS ET CAUSSE-4C,200034064,76,81
CC du Créonnais,CC DU CREONNAIS,243301215,75,33
CC du Crestois et de Pays de Saillans Cœur de Drôme,CC DU CRESTOIS ET PAYS SAILLANS COEUR DR,200040509,84,26
CC du Diois,CC DU DIOIS,242600534,84,26
CC du District Urbain de Faulquemont (DUF),CC FAULQUEMONT,245700133,44,57
CC du Doubs Baumois,CC DU DOUBS BAUMOIS,242504447,27,25
CC du Fronsadais,CC DU FRONSADAIS,243301397,75,33
CC du Frontonnais,CC DU FRONTONNAIS,200034957,76,31
CC du Gâtinais en Bourgogne,CC DU GATINAIS EN BOURGOGNE,248900748,27,89
CC du Genevois,CC DU GENEVOIS,247400690,84,74
CC du Gévaudan,CC DU GEVAUDAN,244800470,76,48
CC du Golfe de Saint-Tropez,CC GOLFE ST-TROPEZ,200036077,93,83
CC du Grand Armagnac,CC GRAND ARMAGNAC,243200458,76,32
CC du Grand Autunois Morvan,CC DU GRAND AUTUNOIS MORVAN,200070530,27,71
CC du Grand Chambord,CC GRAND CHAMBORD,244100798,24,41
CC du Grand Châteaudun,CC DU GRAND CHATEAUDUN,200069961,24,28
CC du Grand Cubzaguais,CC GRAND CUBZAGAIS,243301223,75,33
CC du Grand Langres,CC DU GRAND LANGRES,200072999,44,52
CC du Grand Pic Saint-Loup,CC GRAND PIC ST LOUP,200022986,76,34
CC du Grand Pontarlier,CC DU GRAND PONTARLIER,242500338,27,25
CC du Grand Roye,CC GRAND ROYE,200070977,32,80
CC du Grand Saint-Émilionnais,CC DU GRAND SAINT EMILIONNAIS,200035533,75,33
CC du Guillestrois et du Queyras,CC GUILLESTROIS QUEYRAS,200067452,93,05
CC du Haut-Allier,CC DU HAUT ALLIER,200006930,76,48
CC du Haut-Béarn,CC DU HAUT BEARN,200067262,75,64
CC du Haut-Chablais,CC DU HAUT-CHABLAIS (CCHC),247400682,84,74
CC du Haut-Jura - ARCADE,CC DU HAUT-JURA ARCADE,243900479,27,39
CC du Haut-Lignon,CC DU HAUT LIGNON,244301107,84,43
CC du Haut-Poitou,CC DU HAUT POITOU,200069763,75,86
CC du Haut Pays Bigouden,CC DU HAUT PAYS BIGOUDEN,242900710,53,29
CC du Haut Pays du Montreuillois,CC DU HAUT PAYS DU MONTREUILLOIS,200069235,32,62
CC du Haut Val d'Oise,CC HAUT VAL-D'OISE,249500489,11,95
CC du Haut Vallespir,CC HAUT VALLESPIR,246600548,76,66
CC du Jovinien,CC DU JOVINIEN,248900938,27,89
CC du Kochersberg,CC KOCHERSBERG NOUVELLE,200034635,44,67
CC du Kreiz-Breizh (CCKB),CC KREIZ-BREIZ  ROSTRENEN,242200715,53,22
CC du Lac d'Aiguebelette (CCLA),CC LAC AIGUEBELETTE,247300668,84,73
CC du Lautrécois et du Pays d'Agout,CC LAUTRECOIS-PAYS D'AGOUT,200034056,76,81
CC du Liancourtois,CC LIANCOURTOIS,246000129,32,60
CC du Limouxin,CC DU LIMOUXIN,200071926,76,11
CC du Massif du Sancy,CC MASSIF DU SANCY,246300966,84,"15,63"
CC du Massif du Vercors,CC MASSIF DU VERCORS / CCMV,243801024,84,38
CC du Minervois au Caroux,CC DU MINERVOIS AU CAROUX,200066348,76,34
CC du Mont des Avaloirs,CC MONT DES AVALOIRS - CCMA,200042182,52,53
CC du Montbardois,CC MONTBARDOIS,242101491,27,21
CC du Nivernais Bourbonnais,CC NIVERNAIS-BOURBONNAIS,245804497,27,58
CC du Nogentais,CC DU NOGENTAIS,200006716,44,10
CC du Nord de Mayotte,CC DU NORD DE MAYOTTE,200060465,06,976
CC du Nord Est Béarn,CC NORD EST BEARN,200067296,75,64
CC du Pays Arnay Liernais,CC PAYS ARNAY LIERNAIS,200071173,27,21
CC du Pays Beaume-Drobie,CC DU PAYS BEAUME-DROBIE,240700302,84,07
CC du Pays Bellegardien (CCPB),CC PAYS BELLEGARDIEN,240100891,84,01
CC du Pays Bigouden Sud,CC DU PAYS BIGOUDEN,242900702,53,29
CC du Pays Châtillonnais,CC PAYS CHATILLONNAIS,242101434,27,21
CC du Pays d'Alésia et de la Seine,CC PAYS ALESIA ET SEINE,242101459,27,21
CC du Pays d'Ancenis,CC PAYS D'ANCENIS (COMPA),244400552,52,"44,49"
CC du Pays d'Étain,CC ETAIN,245501242,44,55
CC du Pays d'Héricourt,CC DU PAYS D'HERICOURT,247000722,27,"25,70"
CC du Pays d'Huriel,CC DU PAYS D'HURIEL,240300657,84,03
CC du Pays d'Iroise,CC DU PAYS DE L'IROISE (CCPI),242900074,53,29
CC du Pays d'Issoudun,CC DU PAYS D ISSOUDUN,243600236,24,"18,36"
CC du Pays d'Olmes,CC DU PAYS D'OLMES,240900464,76,09
CC du Pays d'Othe,CC PAYS D'OTHE,241000447,44,10
CC du Pays d'Urfé,CC DU PAYS D'URFE,244200820,84,42
CC du Pays d'Uzerche,CC PAYS UZERCHE,241927243,75,19
CC du Pays de Barr,CC PAYS DE BARR   CCPB,200034270,44,67
CC du Pays de Bitche,CC DU PAYS DE BITCHE,200069441,44,57
CC du Pays de Bray,CC PAYS DE BRAY,246000913,32,60
CC du Pays de Château-Gontier,CC CHATEAU-GONTIER,245300447,52,53
CC du Pays de Colombey et du Sud Toulois,CC COLOMBEY ET SUD TOULOIS,245400510,44,"54,88"
CC du Pays de Conches,CC DU PAYS DE CONCHES,242700276,28,27
CC du Pays de Craon,CC DU PAYS DE CRAON,200048551,52,53
CC du Pays de Cruseilles,CC DU PAYS DE CRUSEILLES,247400112,84,74
CC du Pays de Dol et de la Baie du Mont-Saint-Michel,CC PAYS DOL BAIE MT ST MICHEL,200070670,53,35
CC du Pays de Duras,CC DU PAYS DE DURAS,244700449,75,47
CC du Pays de Falaise,CC PAYS DE FALAISE,241400514,28,14
CC du Pays de Fayence,CC PAYS DE FAYENCE,200004802,93,83
CC du Pays de Fénelon,CC DU PAYS DE FENELON,200040830,75,24
CC du Pays de Honfleur-Beuzeville,CC PAYS HONFLEUR-BEUZEVILLE,200066827,28,"14,27"
CC du Pays de l'Arbresle (CCPA),CC PAYS DE L'ARBRESLE - CCPA,246900625,84,69
CC du Pays de l'Huisne Sarthoise,CC PAYS DE L'HUISNE SARTHOISE,247200686,52,72
CC du Pays de l'Ourcq,CC DE PAYS DE L OURCQ (CCPO),247700065,11,77
CC du Pays de l'Ozon,CC PAYS DE L'OZON - CCPO,246900765,84,69
CC du Pays de la Châtaigneraie,CC PAYS DE LA CHATAIGNERAIE,248500415,52,85
CC du Pays de la Serre,CC DU PAYS DE LA SERRE,240200469,32,02
CC du Pays de la Zorn,CC PAYS DE LA ZORN  CCPZ,246700959,44,67
CC du Pays de Lalbenque-Limogne,CC PAYS DE LALBENQUE-LIMOGNE,244600532,76,46
CC du Pays de Lamastre,CC DU PAYS DE LAMASTRE,200016905,84,07
CC du Pays de Landerneau-Daoulas,CC DE LANDERNEAU DAOULAS,242900801,53,29
CC du Pays de Landivisiau,CC DU PAYS DE LANDIVISIAU,242900751,53,29
CC du Pays de Lapalisse,CC LAPALISSE,240300491,84,03
CC du Pays de Lauzun,CC DU PAYS DE LAUZUN,244700464,75,47
CC du Pays de Limours (CCPL),CC DU PAYS LIMOURS,249100074,11,91
CC du Pays de Lubersac-Pompadour,CC PAYS LUBERSAC-POMPADOUR,200066603,75,19
CC du Pays de Lumbres,CC PAYS DE LUMBRES,246201016,32,62
CC du Pays de Lunel,CC PAYS DE LUNEL,243400520,76,34
CC du Pays de Lure,CC DU PAYS DE LURE,247000664,27,70
CC du Pays de Luxeuil,CC DU PAYS DE LUXEUIL,247000755,27,70
CC du Pays de Maîche,CC DU PAYS DE MAICHE,200023075,27,25
CC du Pays de Mauriac,CC PAYS MAURIAC,241500271,84,15
CC du Pays de Meslay-Grez,CC MESLAY GREZ,245300223,52,53
CC du Pays de Mirepoix,CC DU PAYS DE MIREPOIX,200044469,76,09
CC du Pays de Montbozon et du Chanois,CC DU PAYS DE MONTBOZON ET DU CHANOIS,200041853,27,70
CC du Pays de Montfaucon,CC PAYS MONTFAUCON,244300307,84,43
CC du Pays de Montmédy,CC MONTMEDY,245501259,44,55
CC du Pays de Mormal,CC PAYS DE MORMAL,200043321,32,59
CC du Pays de Mortagne,CC DU PAYS DE MORTAGNE,248500662,52,85
CC du Pays de Mortagne-au-Perche,CC DU PAYS DE MORTAGNE-AU-PERCHE,200036069,28,61
