nom,nom_minimise,SIREN,code_region,code_departement
CC Thelloise,CC THELLOISE,200067973,32,60
CC Thiérache Sambre et Oise,CC THIERACHE SAMBRE ET OISE,200071983,32,02
CC Thiers Dore et Montagne,CC THIERS DORE ET MONTAGNE,200070712,84,63
CC Thoré Montagne Noire,CC THORE MONTAGNE NOIRE,248100745,76,81
CC Tille et Venelle,CC TILLE ET VENELLE,200070910,27,21
CC Touraine-Est Vallées,CC TOURAINE EST VALLEES,200073161,24,37
CC Touraine Ouest Val de Loire,CC TOURAINE OUEST VAL DE LOIRE,200072981,24,37
CC Touraine Val de Vienne,CC TOURAINE VAL DE VIENNE,200072668,24,37
CC Touraine Vallée de l'Indre,CC TOURAINE VALLEE DE L'INDRE,200072650,24,37
CC Usses et Rhône,CC USSES ET RHONE,200070852,84,"01,74"
CC Vaison Ventoux,CC VAISON VENTOUX - COPAVO,248400335,"84,93","26,84"
CC Val-de-Cher-Controis,CC VAL DE CHER CONTROIS,200072064,24,41
CC Val 81,CC VAL-81,248100497,76,81
CC Val Briard,CC VAL BRIARD,200072874,11,77
CC Val de Charente,CC VAL DE CHARENTE,200043016,75,16
CC Val de Gâtine,CC VAL DE GATINE,200069748,75,79
CC Val de Gers,COMMUNAUTE DE COMMUNES VAL DE GERS,200072320,76,32
CC Val de Gray,CC DU VAL DE GRAY,200036549,27,70
CC Val de l'Indre - Brenne,CC VAL DE L INDRE - BRENNE,243600301,24,36
CC Val de Ligne,CC VAL DE LIGNE,240700617,84,07
CC Val de Meuse - Voie Sacrée,CC VAL DE MEUSE VOIE SACREE,200066165,44,55
CC Val de Saône Centre,CC VAL DE SAONE CENTRE,200070118,84,01
CC Val ès Dunes,CC VAL ES DUNES,200065589,28,14
CC Val Eyrieux,CC VAL'EYRIEUX,200041465,84,07
CC Val Guiers,CC VAL GUIERS,247300528,84,73
CC Val Vanoise,CC VAL VANOISE,200040798,84,73
CC Vallée de l'Hérault,CC VALLEE DE L'HERAULT,243400694,76,34
CC Vallée de l'Ubaye - Serre-Ponçon,CC VALLEE DE L'UBAYE-SERRE-PONCON,200072304,93,04
CC Vallée de la Dordogne et Forêt Bessède,CC VALLEE DGNE FORET BESSEDE,200041051,75,24
CC Vallée des Baux-Alpilles (CC VBA),CC VALLEE DES BAUX - ALPILLES,241300375,93,13
CC Vallées de l'Orne et de l'Odon,CC VALLEES ORNE ET ODON,200066728,28,14
CC Vallées et Plateau d'Ardenne,CC VALLEES ET PLATEAU ARDENNE,200067759,44,08
CC Vallons de Haute-Bretagne Communauté,CC VALLONS HAUTE BRETAGNE COMMUNAUTE,200043990,53,35
CC Vendée Grand Littoral,CC VENDEE GRAND LITTORAL,200071900,52,85
"CC Vendée,Sèvre,Autise",CC VENDEE SEVRE AUTISE,248500563,52,85
CC Ventoux Sud,CC VENTOUX SUD,200035723,"84,93","26,84"
CC Vexin Centre,CC-VEXIN-CENTRE,200035970,11,95
CC Vézère-Monédières-Millesources,CC VEZERE MONEDIERES-MILLESOURCES,200066645,75,19
CC Vienne et Gartempe,CC VIENNE ET GARTEMPE,200070043,75,86
CC Vierzon-Sologne-Berry et Villages de la Forêt,CC VIERZON SOLOGNE BERRY,200090561,24,18
CC Vierzon-Sologne-Berry et Villages de la Forêt,CC VILLAGES DE LA FORET,200090561,24,18
CC Xaintrie Val'Dordogne,CC XAINTRIE VAL'DORDOGNE,200066751,75,19
CC Yonne Nord,CC YONNE NORD,248900896,27,89
CC Yvetot Normandie,CC YVETOT NORMANDIE,247600620,28,76
Clermont Auvergne Métropole,MET CLERMONT AUVERGNE METROPOLE,246300701,84,63
CU Angers Loire Métropole,CU ANGERS LOIRE METROPOLE,244900015,52,49
CU Caen la Mer,CU CAEN LA MER,200065597,28,14
CU d'Alençon,CU D'ALENCON,246100663,"28,52","61,72"
CU d'Arras,CU ARRAS,200033579,32,62
CU de Dunkerque,CU DUNKERQUE,245900428,32,59
CU du Grand Besançon Métropole,CU GRAND BESANCON METROPOLE,242500361,27,25
CU du Grand Poitiers,CU GRAND POITIERS,200069854,75,86
CU du Grand Reims,CU DU GRAND REIMS,200067213,44,51
CU du Havre Seine Métropole,CU LE HAVRE SEINE METROPOLE,200084952,28,76
CU Grand Paris Seine et Oise,CU GPSO,200059889,11,78
CU Le Creusot Montceau-les-Mines,CU LE CREUSOT MONTCEAU-LES-MINES,247100290,27,71
CU Le Mans Métropole,CU LE MANS METROPOLE,247200132,52,72
CU Limoges Métropole,CU LIMOGES METROPOLE,248719312,75,87
CU Perpignan Méditerranée Métropole,CU PERPIGNAN MEDITERRANEE METROPOLE,200027183,76,66
Dijon Métropole,MET DIJON METROPOLE,242100410,27,21
Est Ensemble,EST ENSEMBLE T8,200057875,11,93
Eurométropole de Strasbourg,MET EUROMETROPOLE-STRASBOURG,246700488,44,67
Grand-Orly Seine Bièvre,GRAND-ORLY SEINE BIEVRE,200058014,11,94
Grand Paris - Grand Est,GRAND PARIS EST T9,200058790,11,93
Grand Paris Seine Ouest,GPSO,200057974,11,92
Grand Paris Sud Est Avenir,GRAND PARIS SUD EST AVENIR,200058006,11,94
Grenoble-Alpes-Métropole,MET GRENOBLE-ALPES-METROPOLE,200040715,84,38
Métropole d'Aix-Marseille-Provence,MET AIX MARSEILLE PROVENCE,200054807,93,"13,83,84"
Métropole de Lyon,MET DE LYON,200046977,84,69
Métropole du Grand Nancy,MET DU GRAND NANCY,245400676,44,54
Métropole du Grand Paris,METROPOLE DU GRAND PARIS,200054781,11,"75,91,92,93,94,95"
Métropole Européenne de Lille,MET MEL,245900410,32,59
Métropole Nice Côte d'Azur,METROPOLE NCA,200030195,93,06
Métropole Rouen Normandie,MET METROPOLE ROUEN NORMANDIE,200023414,28,76
Métropole Toulon-Provence-Méditerranée,MET TOULON PROVENCE MEDITERRANEE,248300543,93,83
Metz Métropole,MET METZ,200039865,44,57
Montpellier Méditerranée Métropole,MET MONTPELLIER MED,243400017,76,34
Nantes Métropole,MET NANTES METROPOLE,244400404,52,44
Orléans Métropole,MET ORLEANS,244500468,24,45
Paris-Est-Marne et Bois,PARIS-EST-MARNE ET BOIS,200057941,11,94
Paris Ouest La Défense,PARIS OUEST LA DEFENSE,200057982,11,92
Paris Terres d'Envol,PARIS TERRES D'ENVOL T7,200058097,11,93
Plaine Commune,PLAINE COMMUNE T6,200057867,11,93
Rennes Métropole,MET RENNES METROPOLE,243500139,53,35
Saint-Etienne Métropole,MET SAINT-ETIENNE METROPOLE,244200770,84,42
Toulouse Métropole,MET TOULOUSE,243100518,76,31
Tours Métropole Val de Loire,MET TOURS METROPOLE VAL DE LOIRE,243700754,24,37
Vallée Sud Grand Paris,VALLEE SUD-GRAND PARIS,200057966,11,92
,CC MONTS VALLEES OUEST CREUSE,,,
,CA SEINE EURE,,,
,CA GRAND CALAIS TERRES ET MERS,,,
,CC DU PAYS CRECOIS,,,
